published_at,important,positive,negative,BTC,ETH,XRP,BCH,LTC,XLM,EOS,NEO,MIOTA,DASH,XMR,VEN,source,title,domain,id,url
2018-02-25 09:36:23,4,7,0,1,0,0,0,0,0,0,0,0,0,0,0,Cryptovest,Coinbase Announced SegWit Support as Bitcoin Transactions Fees Drop Majorly,cryptovest.com,1194277,https://cryptopanic.com/news/1194277/Coinbase-Announced-SegWit-Support-as-Bitcoin-Transactions-Fees-Drop-Majorly
2018-02-25 05:50:48.599263,21,34,1,1,0,0,0,0,0,0,0,0,0,0,0,Verge Reddit,Nasdaq plans on launching Bitcoin futures first half of 2018..,r/vergecurrency,1193010,https://cryptopanic.com/news/1193010/Nasdaq-plans-on-launching-Bitcoin-futures-first-half-of-2018
2018-02-25 00:37:07.159486,2,7,5,1,0,0,1,0,0,0,0,0,0,0,0,Nano Reddit,NANO passes Bitcoin Cash in 24h Volume,r/nanocurrency,1191287,https://cryptopanic.com/news/1191287/NANO-passes-Bitcoin-Cash-in-24h-Volume
2018-02-24 23:30:25,6,13,0,1,0,0,0,0,0,0,0,0,0,0,0,BTC Manager,U.K Government Set to Create Favorable Regulations for Cryptocurrency,btcmanager.com,1191080,https://cryptopanic.com/news/1191080/UK-Government-Set-to-Create-Favorable-Regulations-for-Cryptocurrency
2018-02-24 22:05:30,9,4,9,1,0,0,0,0,0,0,0,0,0,0,0,CoinTelegraph,Canada: TD Bank Bans Credit Card Purchases of Crypto Following Global Trend,cointelegraph.com,1190429,https://cryptopanic.com/news/1190429/Canada-TD-Bank-Bans-Credit-Card-Purchases-of-Crypto-Following-Global-Trend
2018-02-24 21:18:49,5,1,4,1,0,0,0,0,0,0,0,0,0,0,0,CoinTelegraph,Coinbase Informs 13K Affected Customers Of Imminent Data Handover To IRS,cointelegraph.com,1190066,https://cryptopanic.com/news/1190066/Coinbase-Informs-13K-Affected-Customers-Of-Imminent-Data-Handover-To-IRS
2018-03-08 06:20:25.375100,3,6,0,1,0,0,0,0,0,0,0,0,0,1,0,Verge Reddit,Why Verge and not Monero or Bitcoin Private?,r/vergecurrency,1307392,https://cryptopanic.com/news/1307392/Why-Verge-and-not-Monero-or-Bitcoin-Private
2018-03-07 20:06:02,10,24,2,1,0,0,0,0,0,0,0,0,0,0,0,Live Bitcoin News,Bithumb Looks to Enter the Bitcoin ATM Market,livebitcoinnews.com,1316959,https://cryptopanic.com/news/1316959/Bithumb-Looks-to-Enter-the-Bitcoin-ATM-Market
2018-03-07 19:00:56,7,4,15,1,0,0,0,0,0,0,0,0,0,0,0,Ethereum World News,Bitcoin slides on SEC crypto exchange crackdown fears and Binance hack rumour,ethereumworldnews.com,1316726,https://cryptopanic.com/news/1316726/Bitcoin-slides-on-SEC-crypto-exchange-crackdown-fears-and-Binance-hack-rumour
2018-03-07 18:52:44,5,2,8,1,0,0,0,0,0,0,0,0,0,0,0,Cryptovest,"Binance Hacked? BTC Drops Under $10,000 as Bots Seemingly Sell Alts to Buy Viacoin",cryptovest.com,1316670,https://cryptopanic.com/news/1316670/Binance-Hacked-BTC-Drops-Under-10000-as-Bots-Seemingly-Sell-Alts-to-Buy-Viacoin
2018-03-07 18:35:25,33,7,3,1,1,0,0,0,0,0,0,0,0,0,0,AMBCrypto,"Why are Bitcoin, Ethereum and other coins dropping? Facts and Sentiments now!",ambcrypto.com,1316591,https://cryptopanic.com/news/1316591/Why-are-Bitcoin-Ethereum-and-other-coins-dropping-Facts-and-Sentiments-now
2018-03-07 17:20:54,5,14,1,1,0,0,0,0,0,0,0,0,0,0,0,CryptoPost,Cardano VS Bitcoin – Time To Buy?,cryptopost.com,1315575,https://cryptopanic.com/news/1315575/Cardano-VS-Bitcoin-Time-To-Buy
2018-03-07 17:10:07.815489,10,5,2,1,0,0,0,0,0,0,0,0,0,0,0,r/BitcoinMarkets Reddit,SEC Divisions of Enforcement and Trading and Markets - Statement on Potentially Unlawful Online Platforms for Trading Digital Assets,r/BitcoinMarkets,1315263,https://cryptopanic.com/news/1315263/SEC-Divisions-of-Enforcement-and-Trading-and-Markets-Statement-on-Potentially-Unlawful-Online-Platforms-for-Trading-Digital-Assets
2018-03-07 17:03:07,43,1,32,1,0,0,0,0,0,0,0,0,0,0,0,Trustnodes,"Binance Temporarily Disables Withdrawals, Reports of Unauthorized Selling",trustnodes.com,1315268,https://cryptopanic.com/news/1315268/Binance-Temporarily-Disables-Withdrawals-Reports-of-Unauthorized-Selling
2018-03-07 16:02:38,6,8,0,1,0,0,0,0,0,0,0,0,0,0,0,Bitcoin.com,Popular Social Networks in Russia to Accept Bitcoin,bitcoin.com,1314051,https://cryptopanic.com/news/1314051/Popular-Social-Networks-in-Russia-to-Accept-Bitcoin
2018-03-07 15:38:56,4,7,0,1,0,0,0,0,0,0,0,0,0,0,0,Profit Confidential,"Bitcoin Price Forecast: Russia Finalizing Regulations by July, Bitcoin Future Looks Safe",profitconfidential.com,1313648,https://cryptopanic.com/news/1313648/Bitcoin-Price-Forecast-Russia-Finalizing-Regulations-by-July-Bitcoin-Future-Looks-Safe
2018-03-07 15:17:09,10,14,1,1,0,0,0,0,0,0,0,0,0,0,0,Use The Bitcoin,The Wait is Over: Bitcoin Private Trading is Live on TradeSatoshi,usethebitcoin.com,1313201,https://cryptopanic.com/news/1313201/The-Wait-is-Over-Bitcoin-Private-Trading-is-Live-on-TradeSatoshi
2018-03-07 15:12:52,3,4,1,1,1,1,0,1,0,0,0,0,0,0,0,Trustnodes,"Barry Silbert’s Grayscale Launches Ethereum, Bitcoin Cash, Litecoin and Ripple Investment Trust",trustnodes.com,1313199,https://cryptopanic.com/news/1313199/Barry-Silberts-Grayscale-Launches-Ethereum-Bitcoin-Cash-Litecoin-and-Ripple-Investment-Trust
2018-03-07 14:40:26,5,7,0,1,0,0,0,0,0,0,0,0,0,0,0,Use The Bitcoin,Bithumb Partners with Travel Website to Accept Cryptos and Aims to Install Bitcoin ATMs in South Korea,usethebitcoin.com,1313000,https://cryptopanic.com/news/1313000/Bithumb-Partners-with-Travel-Website-to-Accept-Cryptos-and-Aims-to-Install-Bitcoin-ATMs-in-South-Korea
2018-02-24 20:38:50,7,14,0,1,0,0,0,0,0,0,0,0,0,0,0,CoinTelegraph,"US: Georgia Next State In Line To Accept Crypto For Taxes, Licenses",cointelegraph.com,1189786,https://cryptopanic.com/news/1189786/US-Georgia-Next-State-In-Line-To-Accept-Crypto-For-Taxes-Licenses
2018-02-24 20:20:22.636605,4,5,0,1,0,0,0,0,0,0,0,1,0,0,0,IOTAmarkets Reddit,Iota is like bitcoin in 2012,r/IOTAmarkets,1189555,https://cryptopanic.com/news/1189555/Iota-is-like-bitcoin-in-2012
2018-02-24 18:55:55,4,4,1,1,0,0,0,0,0,0,0,0,0,0,0,Trustnodes,"Alice Weidel, Leader of the Alternative for Germany, to Launch a Bitcoin Startup",trustnodes.com,1188923,https://cryptopanic.com/news/1188923/Alice-Weidel-Leader-of-the-Alternative-for-Germany-to-Launch-a-Bitcoin-Startup
2018-02-24 17:02:58,6,8,0,1,0,0,0,0,0,0,0,0,0,0,0,Use The Bitcoin,Bitmain Mining Company Has Reported Higher Profits than GPU Producer Nvidia,usethebitcoin.com,1188067,https://cryptopanic.com/news/1188067/Bitmain-Mining-Company-Has-Reported-Higher-Profits-than-GPU-Producer-Nvidia
2018-02-24 15:00:21,12,19,0,1,0,0,0,0,0,0,0,0,0,0,0,CoinTelegraph,"Coinbase, GDAX Exchange Platforms Introduce Full SegWit Support",cointelegraph.com,1187096,https://cryptopanic.com/news/1187096/Coinbase-GDAX-Exchange-Platforms-Introduce-Full-SegWit-Support
2018-02-24 14:30:38,2,1,8,1,0,0,0,0,0,0,0,0,0,0,0,Bitcoinist,Coinbase Gives IRS More Than 10K Users’ Information,bitcoinist.com,1187160,https://cryptopanic.com/news/1187160/Coinbase-Gives-IRS-More-Than-10K-Users-Information
2018-02-24 11:00:33,2,6,0,1,0,0,0,0,0,0,0,0,0,0,0,Bitcoinist,Georgia Bill to Allow Tax Payments with Cryptocurrency,bitcoinist.com,1185515,https://cryptopanic.com/news/1185515/Georgia-Bill-to-Allow-Tax-Payments-with-Cryptocurrency
2018-02-24 10:57:41,14,17,0,1,0,0,0,0,0,0,0,0,0,0,0,AMBCrypto,Nano pumps up by 72% on a bearish day – another pump and dump?,ambcrypto.com,1185433,https://cryptopanic.com/news/1185433/Nano-pumps-up-by-72-on-a-bearish-day-another-pump-and-dump
2018-02-24 09:30:18,3,10,0,1,0,0,0,0,0,0,0,0,0,0,0,Bitcoin.com,Bitcoin Is Finding Its Way into High Schools,bitcoin.com,1184838,https://cryptopanic.com/news/1184838/Bitcoin-Is-Finding-Its-Way-into-High-Schools
2018-02-24 08:56:03,7,0,0,1,0,0,0,0,0,0,0,0,0,1,0,AMBCrypto,Why Monero miners prefer hacking computers than mining it like Bitcoin?,ambcrypto.com,1184685,https://cryptopanic.com/news/1184685/Why-Monero-miners-prefer-hacking-computers-than-mining-it-like-Bitcoin
2018-02-24 02:50:58,2,6,0,1,0,0,0,0,0,0,0,0,0,0,0,NewsBTC,Asian Altcoin Trading Roundup: Nano is Leading the Way,newsbtc.com,1182384,https://cryptopanic.com/news/1182384/Asian-Altcoin-Trading-Roundup-Nano-is-Leading-the-Way
2018-02-23 21:15:37,8,17,0,1,0,0,0,0,0,0,0,0,0,0,0,NewsBTC,"GDAX Announce Full SegWit Support, Network Fees Continue to Fall",newsbtc.com,1179792,https://cryptopanic.com/news/1179792/GDAX-Announce-Full-SegWit-Support-Network-Fees-Continue-to-Fall
2018-02-23 21:00:52,21,28,0,1,0,0,0,0,0,0,0,0,0,0,0,Live Bitcoin News,Bank of America Admits it is Threatened by Bitcoin and Cryptocurrencies,livebitcoinnews.com,1179606,https://cryptopanic.com/news/1179606/Bank-of-America-Admits-it-is-Threatened-by-Bitcoin-and-Cryptocurrencies
2018-02-23 19:43:53,8,11,0,1,0,0,0,0,0,0,0,0,0,0,0,Live Bitcoin News,One in Three UK SMEs Thinks Bitcoin Will go Mainstream by 2020,livebitcoinnews.com,1178753,https://cryptopanic.com/news/1178753/One-in-Three-UK-SMEs-Thinks-Bitcoin-Will-go-Mainstream-by-2020
2018-02-23 18:23:52,17,30,0,1,0,0,0,0,0,0,0,0,0,0,0,CoinTelegraph,Bank Of America: Our ‘Inability To Adapt’ Could See A Failure To Compete With Crypto,cointelegraph.com,1177981,https://cryptopanic.com/news/1177981/Bank-Of-America-Our-Inability-To-Adapt-Could-See-A-Failure-To-Compete-With-Crypto
2018-02-23 17:22:10,2,5,0,1,0,0,0,0,0,0,0,0,0,0,0,CoinTelegraph,Sprechen Sie Deutsch? Cointelegraph Launches German Version,cointelegraph.com,1177379,https://cryptopanic.com/news/1177379/Sprechen-Sie-Deutsch-Cointelegraph-Launches-German-Version
2018-02-23 17:00:42.407487,5,7,0,1,0,0,0,0,0,0,0,0,0,0,0,r/BitcoinMarkets Reddit,"Dutch Bank ING Confirms Bitfinex Has Account, Extent of Relationship Unclear",r/BitcoinMarkets,1177106,https://cryptopanic.com/news/1177106/Dutch-Bank-ING-Confirms-Bitfinex-Has-Account-Extent-of-Relationship-Unclear
2018-02-23 16:32:12,10,16,0,1,1,0,0,0,0,0,0,0,0,0,0,AMBCrypto,Indian exchange Zebpay adds Ethereum to its trading platform – sees a 19% jump,ambcrypto.com,1176850,https://cryptopanic.com/news/1176850/Indian-exchange-Zebpay-adds-Ethereum-to-its-trading-platform-sees-a-19-jump
2018-02-23 16:29:00,7,10,0,1,0,0,0,0,0,0,0,0,0,0,0,Investopedia,Bitcoin Exchanges Make Transactions 20% Cheaper,investopedia.com,1176971,https://cryptopanic.com/news/1176971/Bitcoin-Exchanges-Make-Transactions-20-Cheaper
2018-02-23 16:28:12,4,9,0,1,0,0,0,0,0,0,0,0,0,0,0,CoinTelegraph,Japan: Only 0.16% Of 2017 Money Laundering Reports Came From Crypto Exchanges,cointelegraph.com,1176856,https://cryptopanic.com/news/1176856/Japan-Only-016-Of-2017-Money-Laundering-Reports-Came-From-Crypto-Exchanges
2018-02-23 15:45:31,5,6,0,1,0,0,0,0,0,0,0,0,0,0,0,CoinDesk,Georgia Becomes Latest State to Consider Bitcoin for Tax Payments,coindesk.com,1176698,https://cryptopanic.com/news/1176698/Georgia-Becomes-Latest-State-to-Consider-Bitcoin-for-Tax-Payments
2018-02-23 15:00:30,16,26,1,1,0,0,0,0,0,0,0,0,0,0,0,Bitcoinist,Bank of America Admits Bitcoin is a Threat in SEC Report,bitcoinist.com,1176030,https://cryptopanic.com/news/1176030/Bank-of-America-Admits-Bitcoin-is-a-Threat-in-SEC-Report
2018-02-23 14:44:51,5,13,1,1,0,0,0,0,0,0,0,0,0,0,0,Trustnodes,Elon Musk is a Bitcoin Hodler and a Bitcoin Maximalist,trustnodes.com,1175655,https://cryptopanic.com/news/1175655/Elon-Musk-is-a-Bitcoin-Hodler-and-a-Bitcoin-Maximalist
2018-02-23 14:00:50,6,8,0,1,0,0,0,0,0,0,0,0,0,0,0,Use The Bitcoin,Australian University RMIT to Offer Blockchain-Oriented Classes,usethebitcoin.com,1175046,https://cryptopanic.com/news/1175046/Australian-University-RMIT-to-Offer-Blockchain-Oriented-Classes
2018-02-23 13:32:40,9,14,0,1,0,0,0,0,0,0,0,0,0,0,0,Use The Bitcoin,Cryptocurrencies vs. PayPal – Battle For The Future Of Payments,usethebitcoin.com,1174858,https://cryptopanic.com/news/1174858/Cryptocurrencies-vs-PayPal-Battle-For-The-Future-Of-Payments
2018-02-23 10:00:27,10,30,0,1,0,0,0,0,0,0,0,0,0,0,0,NewsBTC,"Despite Slow Start, Analysts Believe 2018 Could be the Best Year for Bitcoin",newsbtc.com,1173186,https://cryptopanic.com/news/1173186/Despite-Slow-Start-Analysts-Believe-2018-Could-be-the-Best-Year-for-Bitcoin
2018-02-23 09:44:03,2,8,1,1,0,0,0,0,0,0,0,0,0,0,0,Coindoo,Turkey Looking to Launch National Cryptocurrency,coindoo.com,1173014,https://cryptopanic.com/news/1173014/Turkey-Looking-to-Launch-National-Cryptocurrency
2018-02-23 08:48:51,7,9,0,1,0,0,0,0,0,0,0,0,0,0,0,AMBCrypto,California becomes the latest state to present a bill on Bitcoin and Blockchain Technology,ambcrypto.com,1172650,https://cryptopanic.com/news/1172650/California-becomes-the-latest-state-to-present-a-bill-on-Bitcoin-and-Blockchain-Technology
2018-02-23 08:47:39,6,7,0,1,1,0,0,0,0,0,0,0,0,0,0,Use The Bitcoin,Zero-Fee crypto Exchange Robinhood Starts Operating in Five US States,usethebitcoin.com,1172659,https://cryptopanic.com/news/1172659/Zero-Fee-crypto-Exchange-Robinhood-Starts-Operating-in-Five-US-States
2018-02-23 06:01:13,3,6,0,1,0,0,0,0,0,0,0,0,0,0,0,Bitcoin.com,"Crypto-Backed SALT Claims $1.3 Billion Backlog, Suspends New Memberships",bitcoin.com,1171640,https://cryptopanic.com/news/1171640/Crypto-Backed-SALT-Claims-13-Billion-Backlog-Suspends-New-Memberships
2018-02-23 03:39:56,8,12,1,1,0,0,0,0,0,0,0,0,0,0,0,AMBCrypto,TRON [TRX] poised to gain big post the end of the bearish market,ambcrypto.com,1170654,https://cryptopanic.com/news/1170654/TRON-TRX-poised-to-gain-big-post-the-end-of-the-bearish-market
2018-02-22 23:34:49,4,11,0,1,0,0,0,0,0,0,0,0,0,0,0,ZyCrypto,Segwit release 0.16.0 prepares Bitcoin Core for next ‘bull run’,zycrypto.com,1169103,https://cryptopanic.com/news/1169103/Segwit-release-0160-prepares-Bitcoin-Core-for-next-bull-run
2018-02-22 21:55:21,11,17,2,1,0,0,0,0,0,0,0,0,0,0,0,Bitcoin.com,Venezuela Orders Government Services to Accept Any Cryptocurrency,bitcoin.com,1167895,https://cryptopanic.com/news/1167895/Venezuela-Orders-Government-Services-to-Accept-Any-Cryptocurrency
2018-02-22 21:37:00,19,32,0,1,1,0,0,0,0,0,0,0,0,0,0,Ethereum World News,No Fee Ethereum and Bitcoin Trading: Robinhood is ON,ethereumworldnews.com,1167751,https://cryptopanic.com/news/1167751/No-Fee-Ethereum-and-Bitcoin-Trading-Robinhood-is-ON
2018-02-22 20:31:00.722835,6,7,0,1,0,0,0,0,0,0,0,0,0,0,0,r/Bitcoin Reddit,Bitcoin Core 0.16.0 (final) has just been tagged!,r/Bitcoin,1167021,https://cryptopanic.com/news/1167021/Bitcoin-Core-0160-final-has-just-been-tagged
2018-02-22 20:10:43.463169,0,2,22,1,0,0,1,0,0,0,0,0,0,0,0,r/btc Reddit,Bitcoin Cash is King,r/btc,1166841,https://cryptopanic.com/news/1166841/Bitcoin-Cash-is-King
2018-02-22 19:17:57,3,6,0,1,0,0,0,0,0,0,0,0,0,0,0,Erik Voorhees,ShapeShift (2% of Bitcoin Network) is Now Batching Transactions #bitcoin @shapeshift_io,@ErikVoorhees,1166270,https://cryptopanic.com/news/1166270/ShapeShift-2-of-Bitcoin-Network-is-Now-Batching-Transactions-bitcoin-shapeshift_io
2018-02-22 17:13:03,5,12,0,1,1,0,0,0,0,0,0,0,0,0,0,CoinTelegraph,"Robinhood’s Zero-Fee Bitcoin, Ethereum Trading Is Live In Five US States",cointelegraph.com,1164918,https://cryptopanic.com/news/1164918/Robinhoods-Zero-Fee-Bitcoin-Ethereum-Trading-Is-Live-In-Five-US-States
2018-02-22 16:55:30,14,35,0,1,1,0,0,0,0,0,0,0,0,0,0,Bitcoin.com,Robinhood Starts Rolling Out Cryptocurrency Trading Today,bitcoin.com,1164637,https://cryptopanic.com/news/1164637/Robinhood-Starts-Rolling-Out-Cryptocurrency-Trading-Today
2018-02-22 16:33:06,3,6,7,1,0,0,0,0,0,0,0,0,0,0,0,Cryptovest,"U.K. Announces Inquiry into Crypto Space; Bitcoin Slides Below $10,000 on the News",cryptovest.com,1164444,https://cryptopanic.com/news/1164444/UK-Announces-Inquiry-into-Crypto-Space-Bitcoin-Slides-Below-10000-on-the-News
2018-02-22 16:25:58,4,7,0,1,0,0,0,0,0,0,0,0,0,0,0,Bitcoin.com,20+ South Korean Cryptocurrency Exchanges Voluntarily Undergo Evaluations,bitcoin.com,1164301,https://cryptopanic.com/news/1164301/20-South-Korean-Cryptocurrency-Exchanges-Voluntarily-Undergo-Evaluations
2018-02-22 15:30:48,3,8,0,1,0,0,0,0,0,0,0,0,0,0,0,Bitcoin.com,Russian Lawmaker Proposes Legalization of Cryptocurrencies to Attract Investments,bitcoin.com,1163701,https://cryptopanic.com/news/1163701/Russian-Lawmaker-Proposes-Legalization-of-Cryptocurrencies-to-Attract-Investments
2018-02-22 15:18:45,6,8,2,1,0,0,0,0,0,0,0,0,0,0,0,Profit Confidential,Bitcoin Price Forecast: Bitcoin Is Fueling the “Internet of Money”,profitconfidential.com,1163488,https://cryptopanic.com/news/1163488/Bitcoin-Price-Forecast-Bitcoin-Is-Fueling-the-Internet-of-Money
2018-02-22 13:58:40,5,14,0,1,1,1,0,1,0,0,0,0,0,1,0,CoinJournal,Cryptocurrency Exchange Coinsquare To Add Credit Card Payment Method,coinjournal.net,1162464,https://cryptopanic.com/news/1162464/Cryptocurrency-Exchange-Coinsquare-To-Add-Credit-Card-Payment-Method
2018-02-22 12:10:29,6,6,0,1,0,0,0,1,0,0,0,0,0,0,0,Use The Bitcoin,How To Start Mining Litecoin In 2018,usethebitcoin.com,1161255,https://cryptopanic.com/news/1161255/How-To-Start-Mining-Litecoin-In-2018
2018-02-22 10:40:39,5,3,0,1,0,0,0,0,0,0,0,0,0,0,0,Coindoo,UK: Treasury Committee Starts an Investigation Into Cryptocurrency,coindoo.com,1160522,https://cryptopanic.com/news/1160522/UK-Treasury-Committee-Starts-an-Investigation-Into-Cryptocurrency
2018-02-22 10:08:42,9,10,0,1,0,0,0,0,0,0,0,0,0,0,0,AMBCrypto,Immature Bitcoin and crypto regulation bill worries the Russian government,ambcrypto.com,1160142,https://cryptopanic.com/news/1160142/Immature-Bitcoin-and-crypto-regulation-bill-worries-the-Russian-government
2018-02-22 09:57:22,4,6,0,1,0,0,0,0,0,0,0,0,0,0,0,CoinTelegraph,Confirmed: Bitfinex Exchange Has Account On Dutch ING Bank,cointelegraph.com,1160145,https://cryptopanic.com/news/1160145/Confirmed-Bitfinex-Exchange-Has-Account-On-Dutch-ING-Bank
2018-02-22 09:47:44,1,7,0,1,0,0,0,0,0,0,0,0,0,0,0,Coindoo,Ubisoft Experimenting with Blockchain to Enhance Game Experience,coindoo.com,1159938,https://cryptopanic.com/news/1159938/Ubisoft-Experimenting-with-Blockchain-to-Enhance-Game-Experience
2018-02-22 01:00:14,4,16,0,1,0,0,0,0,0,0,0,0,0,0,0,Bitcoinist,PayPal CFO: Bitcoin’s Success is Very Likely,bitcoinist.com,1156513,https://cryptopanic.com/news/1156513/PayPal-CFO-Bitcoins-Success-is-Very-Likely
2018-02-21 20:40:17,19,29,2,1,1,0,0,0,0,0,0,1,0,0,0,Use The Bitcoin,Top 3 Cryptocurrencies From The Technological Point-of-View,usethebitcoin.com,1153759,https://cryptopanic.com/news/1153759/Top-3-Cryptocurrencies-From-The-Technological-Point-of-View
2018-02-21 20:00:35,10,12,0,1,0,0,0,0,0,0,0,0,0,0,0,NewsBTC,New Jersey High School Offering Lessons In Cryptocurrency and Blockchain,newsbtc.com,1153363,https://cryptopanic.com/news/1153363/New-Jersey-High-School-Offering-Lessons-In-Cryptocurrency-and-Blockchain
2018-02-21 19:41:57,34,47,0,1,0,0,0,0,0,0,0,0,0,0,0,Use The Bitcoin,Bitcoin Fees Reach 6 Month Low After SegWit Wider Adoption,usethebitcoin.com,1153121,https://cryptopanic.com/news/1153121/Bitcoin-Fees-Reach-6-Month-Low-After-SegWit-Wider-Adoption
2018-02-21 18:19:35,6,10,0,1,0,0,0,0,0,0,0,0,0,0,0,ZyCrypto,"Hong Kong’s Bitfinex Introduces SegWit, Makes Everyone Happy",zycrypto.com,1152256,https://cryptopanic.com/news/1152256/Hong-Kongs-Bitfinex-Introduces-SegWit-Makes-Everyone-Happy
2018-02-21 16:48:21,7,11,0,1,0,0,0,1,0,0,0,0,0,0,0,Profit Confidential,Litecoin Price Forecast: Bitcoin’s SegWit Adoption a Blessing for Litecoin?,profitconfidential.com,1151256,https://cryptopanic.com/news/1151256/Litecoin-Price-Forecast-Bitcoins-SegWit-Adoption-a-Blessing-for-Litecoin
2018-02-21 16:38:01,24,46,1,1,0,0,0,0,0,0,0,0,0,0,0,ZyCrypto,Experts predict a growth of up to 5X on cryptocurrencies market by 2018,zycrypto.com,1151162,https://cryptopanic.com/news/1151162/Experts-predict-a-growth-of-up-to-5X-on-cryptocurrencies-market-by-2018
2018-02-21 14:37:11,3,7,0,1,0,0,0,0,0,0,0,0,0,0,0,CoinGape,California Bill To Recognize Use of Blockchain Data And Smart Contracts,coingape.com,1149796,https://cryptopanic.com/news/1149796/California-Bill-To-Recognize-Use-of-Blockchain-Data-And-Smart-Contracts
2018-02-21 14:30:56,8,15,5,1,0,0,0,0,0,0,0,0,0,0,0,Ethereum World News,Bitcoin Ready to Test 12k,ethereumworldnews.com,1149685,https://cryptopanic.com/news/1149685/Bitcoin-Ready-to-Test-12k
2018-02-21 13:46:01,0,0,7,1,0,0,0,0,0,0,0,0,0,0,0,CoinTelegraph,"Japan: Zaif Exchange Reports ‘Glitch’, $20 Trillion in BTC Temporarily ‘Purchased’ For 0 Yen",cointelegraph.com,1149186,https://cryptopanic.com/news/1149186/Japan-Zaif-Exchange-Reports-Glitch-20-Trillion-in-BTC-Temporarily-Purchased-For-0-Yen
2018-02-21 13:01:56,1,10,1,1,1,1,0,0,1,0,1,0,1,1,0,CoinJournal,Study: SMEs Believe Cryptocurrency Payments Will Hit the High Street in Two Years,coinjournal.net,1148697,https://cryptopanic.com/news/1148697/Study-SMEs-Believe-Cryptocurrency-Payments-Will-Hit-the-High-Street-in-Two-Years
2018-02-21 12:53:53,2,5,0,1,0,0,0,0,0,0,0,0,0,0,0,CryptoNinjas,India’s Unocoin app updated to bring all coins onboard for exchange,cryptoninjas.net,1148530,https://cryptopanic.com/news/1148530/Indias-Unocoin-app-updated-to-bring-all-coins-onboard-for-exchange
2018-02-21 12:42:04,13,18,0,1,0,0,0,0,0,0,0,0,0,0,0,Use The Bitcoin,Segregated Witness Implemented in Coinbase and Bitfinex – Bitcoin Network Upgrade,usethebitcoin.com,1148416,https://cryptopanic.com/news/1148416/Segregated-Witness-Implemented-in-Coinbase-and-Bitfinex-Bitcoin-Network-Upgrade
2018-02-21 10:30:08,1,6,1,1,0,0,0,0,0,0,0,0,0,0,0,BTC Manager,Price of Bitcoin Climbs as Unknown Trader Acquires $344 Million in Bitcoin,btcmanager.com,1147495,https://cryptopanic.com/news/1147495/Price-of-Bitcoin-Climbs-as-Unknown-Trader-Acquires-344-Million-in-Bitcoin
2018-02-21 10:27:34,9,12,0,1,0,0,0,0,0,0,0,0,0,0,0,Coindoo,Malta is Preparing to Become the World’s First Blockchain Regulated State,coindoo.com,1147335,https://cryptopanic.com/news/1147335/Malta-is-Preparing-to-Become-the-Worlds-First-Blockchain-Regulated-State
2018-02-21 09:05:04,5,4,1,1,0,0,0,0,0,0,0,0,0,0,0,Coindoo,The Central Bank of Poland Sponsored a Smear Campaign About Crypto Assets,coindoo.com,1146613,https://cryptopanic.com/news/1146613/The-Central-Bank-of-Poland-Sponsored-a-Smear-Campaign-About-Crypto-Assets
2018-02-21 08:38:49,6,10,0,1,0,0,0,0,0,0,0,0,0,0,0,Cryptovest,"Crypto Market Cruises Past $500B, Bitcoin Nears $12,000",cryptovest.com,1146441,https://cryptopanic.com/news/1146441/Crypto-Market-Cruises-Past-500B-Bitcoin-Nears-12000
2018-02-21 06:43:21,18,22,6,1,0,0,0,0,0,0,0,0,0,0,0,AMBCrypto,Bitcoin considered Property in Israel – businesses accepting crypto to pay heavily,ambcrypto.com,1145590,https://cryptopanic.com/news/1145590/Bitcoin-considered-Property-in-Israel-businesses-accepting-crypto-to-pay-heavily
2018-02-21 00:25:57,0,8,0,1,0,0,0,0,0,0,0,0,0,0,0,Bitcoin.com,Tim Draper on Bitcoin: “Why Would I Sell the Future for the Past?”,bitcoin.com,1142867,https://cryptopanic.com/news/1142867/Tim-Draper-on-Bitcoin-Why-Would-I-Sell-the-Future-for-the-Past
2018-02-20 22:59:16,1,0,8,1,0,0,0,0,0,0,0,0,0,0,0,Bitcoin.com,US Federal Authorities Arrest Man for Selling 9.99 Bitcoin,bitcoin.com,1141935,https://cryptopanic.com/news/1141935/US-Federal-Authorities-Arrest-Man-for-Selling-999-Bitcoin
2018-02-20 21:25:19,5,1,12,1,0,0,0,0,0,0,0,0,0,0,0,Bitcoin.com,Bangladesh Authorities on “Hunt” for Bitcoin Traders,bitcoin.com,1141024,https://cryptopanic.com/news/1141024/Bangladesh-Authorities-on-Hunt-for-Bitcoin-Traders
2018-02-20 21:20:23,3,4,2,1,0,1,0,1,0,0,0,0,0,0,0,Ethereum World News,Cryptocurrency Forecast: Litecoin Storms Upwards While Ripple Struggles,ethereumworldnews.com,1141036,https://cryptopanic.com/news/1141036/Cryptocurrency-Forecast-Litecoin-Storms-Upwards-While-Ripple-Struggles
2018-02-20 21:15:38,3,6,2,1,0,0,0,0,0,0,0,0,0,0,0,Live Bitcoin News,Nasdaq Prepares to Delist Long Blockchain as Stock Fails to Impress Investors,livebitcoinnews.com,1140952,https://cryptopanic.com/news/1140952/Nasdaq-Prepares-to-Delist-Long-Blockchain-as-Stock-Fails-to-Impress-Investors
2018-02-20 20:30:59,4,6,0,1,0,0,0,0,0,0,0,0,0,0,0,Bitcoinist,Bitcoin Will Be the Real Winner in the War on Cash,bitcoinist.com,1140728,https://cryptopanic.com/news/1140728/Bitcoin-Will-Be-the-Real-Winner-in-the-War-on-Cash
2018-02-20 20:30:28,5,12,0,1,0,0,0,0,0,0,0,0,0,0,0,NewsBTC,"SegWit Finally Embraced by Coinbase and Bitfinex, Bright Future Ahead",newsbtc.com,1140631,https://cryptopanic.com/news/1140631/SegWit-Finally-Embraced-by-Coinbase-and-Bitfinex-Bright-Future-Ahead
2018-02-20 20:21:13,14,30,1,1,0,0,0,0,0,0,0,0,0,0,0,CoinTelegraph,PayPal Exec Says ‘Very High Likelihood’ Bitcoin Will Become Popular Payment Method,cointelegraph.com,1140414,https://cryptopanic.com/news/1140414/PayPal-Exec-Says-Very-High-Likelihood-Bitcoin-Will-Become-Popular-Payment-Method
2018-02-20 20:10:52.207613,24,42,3,1,0,0,0,0,0,0,0,0,0,0,0,r/Bitcoin Reddit,"Finally! Coinbase: ""Our engineering team has finished testing of SegWit for Bitcoin on Coinbase. We will be starting a phased launch to customers over the next few days and are targeting a 100% launch to all customers by mid next week"".",r/Bitcoin,1140207,https://cryptopanic.com/news/1140207/Finally-Coinbase-Our-engineering-team-has-finished-testing-of-SegWit-for-Bitcoin-on-Coinbase-We-will-be-starting-a-phased-launch-to-customers-over-the-next-few-days-and-are-targeting-a-100-launch-to-all-customers-by-mid-next-week
2018-02-20 19:59:49,3,5,0,1,0,0,0,0,0,0,0,0,0,0,0,Live Bitcoin News,Coinbase Commences Phased Rollout of Native SegWit Support,livebitcoinnews.com,1140092,https://cryptopanic.com/news/1140092/Coinbase-Commences-Phased-Rollout-of-Native-SegWit-Support
2018-02-20 18:10:36.416363,7,9,0,1,0,0,0,0,0,0,0,0,0,0,0,r/Bitcoin Reddit,Coinbase targeting Segwit support by next week,r/Bitcoin,1138934,https://cryptopanic.com/news/1138934/Coinbase-targeting-Segwit-support-by-next-week
2018-02-20 17:01:57.533892,14,18,0,1,0,0,0,0,0,0,0,0,0,0,0,r/Bitcoin Reddit,Bitfinex Adopts SegWit,r/Bitcoin,1138084,https://cryptopanic.com/news/1138084/Bitfinex-Adopts-SegWit
2018-02-20 16:25:31,5,9,1,1,1,1,0,0,0,0,0,0,0,0,0,Bitcoin.com,Markets Update: Bullish Sentiment Returns to Crypto Markets,bitcoin.com,1137712,https://cryptopanic.com/news/1137712/Markets-Update-Bullish-Sentiment-Returns-to-Crypto-Markets
