published_at,important,positive,negative,BTC,ETH,XRP,BCH,LTC,XLM,EOS,NEO,MIOTA,DASH,XMR,VEN,source,title,domain,id,url
2018-02-02 05:20:19.407531,2,1,2,1,0,0,0,0,0,0,0,0,0,0,0,NEM Reddit,Bitcoin Prices Fall Amid Reports Of India Crypto Regulation,r/nem,961584,https://cryptopanic.com/news/961584/Bitcoin-Prices-Fall-Amid-Reports-Of-India-Crypto-Regulation
2018-02-02 03:30:11,16,25,0,1,1,0,0,0,0,0,0,0,0,1,0,Bitcoin.com,AMD Increases GPU Production to Match Crypto Mining Demand,bitcoin.com,961419,https://cryptopanic.com/news/961419/AMD-Increases-GPU-Production-to-Match-Crypto-Mining-Demand
2018-02-02 03:10:23.135900,3,13,0,1,0,0,0,0,0,0,0,0,0,0,0,r/BitcoinMarkets Reddit,My case for you to dump USD assets and BTFBD,r/BitcoinMarkets,961399,https://cryptopanic.com/news/961399/My-case-for-you-to-dump-USD-assets-and-BTFBD
2018-02-02 00:49:21,1,4,9,1,0,0,0,0,0,0,0,0,0,0,0,CoinTelegraph,Wolf Of Wall Street Says Bitcoin Could Hit $50K Before Crashing,cointelegraph.com,960730,https://cryptopanic.com/news/960730/Wolf-Of-Wall-Street-Says-Bitcoin-Could-Hit-50K-Before-Crashing
2018-02-01 23:55:51,10,7,15,1,0,0,0,0,0,0,0,0,0,0,0,Bitcoin.com,Coinbase Sends American Clients IRS Tax Form 1099-K,bitcoin.com,960239,https://cryptopanic.com/news/960239/Coinbase-Sends-American-Clients-IRS-Tax-Form-1099-K
2018-02-01 22:30:47.360617,10,40,3,1,0,0,0,0,0,0,0,0,0,0,0,r/BitcoinMarkets Reddit,BTC - buy with both hands at 8145 and below...here's why,r/BitcoinMarkets,960117,https://cryptopanic.com/news/960117/BTC-buy-with-both-hands-at-8145-and-belowheres-why
2018-02-01 22:05:02,15,17,1,1,0,0,0,0,0,0,0,0,0,0,0,BTC Manager,Major Bitcoin Exchange Bittrex Indicates it will Open up to USD Deposits,btcmanager.com,960150,https://cryptopanic.com/news/960150/Major-Bitcoin-Exchange-Bittrex-Indicates-it-will-Open-up-to-USD-Deposits
2018-02-01 21:35:03,10,24,0,1,0,0,0,0,0,0,0,0,1,0,0,ZyCrypto,Brisbane Airport starts accepting cryptocurrencies as a means of payment,zycrypto.com,960008,https://cryptopanic.com/news/960008/Brisbane-Airport-starts-accepting-cryptocurrencies-as-a-means-of-payment
2018-02-01 21:23:50,3,19,0,1,0,0,0,0,0,0,0,0,0,0,0,CryptoBriefing,"FUD This Shit, I’m Buying Some Bitcoin",cryptobriefing.com,959968,https://cryptopanic.com/news/959968/FUD-This-Shit-Im-Buying-Some-Bitcoin
2018-02-01 21:10:17,2,5,1,1,0,0,1,0,0,0,0,0,0,0,0,Bitcoin.com,Bitcoin.com Introduces the New Buy Bitcoin Cash Portal,bitcoin.com,959965,https://cryptopanic.com/news/959965/Bitcoincom-Introduces-the-New-Buy-Bitcoin-Cash-Portal
2018-02-01 20:49:57,12,29,1,1,1,0,0,0,0,0,0,0,0,0,0,Use The Bitcoin,Will Ethereum be a Better Investment than Bitcoin in 2018?,usethebitcoin.com,959901,https://cryptopanic.com/news/959901/Will-Ethereum-be-a-Better-Investment-than-Bitcoin-in-2018
2018-02-01 20:11:09,17,25,0,1,0,0,0,0,0,0,0,1,0,0,0,CoinJournal,City of Taipei to Use IOTA’s Blockless Tangle for its Smart City Goals,coinjournal.net,959551,https://cryptopanic.com/news/959551/City-of-Taipei-to-Use-IOTAs-Blockless-Tangle-for-its-Smart-City-Goals
2018-02-01 20:00:16,1,5,0,1,0,0,0,0,0,0,0,0,0,0,0,Bitcoinist,Twitter CEO Jack Dorsey: Bitcoin Provides Broader Financial Access for All,bitcoinist.com,959630,https://cryptopanic.com/news/959630/Twitter-CEO-Jack-Dorsey-Bitcoin-Provides-Broader-Financial-Access-for-All
2018-02-01 17:55:06,4,5,8,1,0,0,0,0,0,0,0,0,0,0,0,Trustnodes,"Bitcoin Breaks Below $9,000",trustnodes.com,958262,https://cryptopanic.com/news/958262/Bitcoin-Breaks-Below-9000
2018-02-01 16:35:06.626881,19,39,2,1,1,0,0,0,0,0,0,0,0,0,0,Reddit - cryptocurrency,Tired of waking up seeing red? Then start trading with ETH instead of BTC,r/CryptoCurrency,957310,https://cryptopanic.com/news/957310/Tired-of-waking-up-seeing-red-Then-start-trading-with-ETH-instead-of-BTC
2018-02-01 16:30:37,1,7,0,1,0,0,0,1,0,0,0,0,0,0,0,Profit Confidential,Litecoin Price Prediction 2018: Is Litecoin Potential Higher Than Current Counterparts?,profitconfidential.com,957415,https://cryptopanic.com/news/957415/Litecoin-Price-Prediction-2018-Is-Litecoin-Potential-Higher-Than-Current-Counterparts
2018-02-01 15:45:59,16,30,26,1,0,1,0,1,0,0,0,0,0,0,0,Profit Confidential,Cryptocurrency Price Predictions 2018: Ripple Is the Clear Winner,profitconfidential.com,15246,https://cryptopanic.com/news/15246/Cryptocurrency-Price-Predictions-2018-Ripple-Is-the-Clear-Winner
2018-02-01 15:31:07,1,0,7,1,0,0,0,0,0,0,0,0,0,0,0,Live Bitcoin News,"Bitcoin is No Substitute to Replace Gold, Says World Gold Council",livebitcoinnews.com,956700,https://cryptopanic.com/news/956700/Bitcoin-is-No-Substitute-to-Replace-Gold-Says-World-Gold-Council
2018-02-01 15:25:06.159430,15,30,0,1,1,0,0,0,0,0,0,0,0,0,0,Reddit - cryptocurrency,Ethereum Really Starting To Separate Itself From Bitcoin In A Big Way,r/CryptoCurrency,956598,https://cryptopanic.com/news/956598/Ethereum-Really-Starting-To-Separate-Itself-From-Bitcoin-In-A-Big-Way
2018-02-01 14:42:04,55,71,4,1,0,0,0,0,0,0,0,0,0,0,0,AMBCrypto,Bitcoin is not banned in India – community lashes out at misinterpreted news published by certain news sites,ambcrypto.com,956209,https://cryptopanic.com/news/956209/Bitcoin-is-not-banned-in-India-community-lashes-out-at-misinterpreted-news-published-by-certain-news-sites
2018-02-01 14:37:34,9,18,0,1,1,0,0,0,0,0,0,0,0,0,0,Trustnodes,"Ethereum Up, Bitcoin Down, Gap Closes to $40 Billion, is the Flippening Nigh?",trustnodes.com,956142,https://cryptopanic.com/news/956142/Ethereum-Up-Bitcoin-Down-Gap-Closes-to-40-Billion-is-the-Flippening-Nigh
2018-02-01 14:00:46,5,14,0,1,0,0,0,0,0,0,0,0,0,0,0,NewsBTC,Cash Carrying Japan Crazy for Crypto,newsbtc.com,955745,https://cryptopanic.com/news/955745/Cash-Carrying-Japan-Crazy-for-Crypto
2018-02-01 13:48:27,7,12,1,1,0,0,0,1,0,0,0,0,0,0,0,Profit Confidential,Litecoin Price Prediction: Upcoming Litecoin Upgrade to Put LTC Ahead of BTC,profitconfidential.com,955746,https://cryptopanic.com/news/955746/Litecoin-Price-Prediction-Upcoming-Litecoin-Upgrade-to-Put-LTC-Ahead-of-BTC
2018-02-01 13:46:33,1,5,0,1,0,0,0,0,0,0,0,0,0,0,0,ZyCrypto,Turkish football club demonstrates utility of Bitcoin.,zycrypto.com,955594,https://cryptopanic.com/news/955594/Turkish-football-club-demonstrates-utility-of-Bitcoin
2018-02-01 13:40:48,2,6,0,1,0,1,0,0,0,0,0,0,0,0,0,Live Bitcoin News,"Unocoin Announces Support for Bitcoin Cash, XRP, and Other Currencies",livebitcoinnews.com,955498,https://cryptopanic.com/news/955498/Unocoin-Announces-Support-for-Bitcoin-Cash-XRP-and-Other-Currencies
2018-02-01 13:01:44,6,2,10,1,0,0,0,0,0,0,0,0,0,0,0,Quartz,"In one brutal month, nearly $50 billion was wiped off of bitcoin’s market value",qz.com,955143,https://cryptopanic.com/news/955143/In-one-brutal-month-nearly-50-billion-was-wiped-off-of-bitcoins-market-value
2018-02-01 12:52:19,7,4,14,1,0,0,0,0,0,0,0,0,0,0,0,Live Bitcoin News,"India Wants to ‘Eliminate’ the Use of Cryptocurrencies, Embraces the Blockchain",livebitcoinnews.com,955020,https://cryptopanic.com/news/955020/India-Wants-to-Eliminate-the-Use-of-Cryptocurrencies-Embraces-the-Blockchain
2018-02-01 12:46:40,10,21,2,1,0,0,0,0,0,0,0,0,0,0,0,Coindoo,Samsung is Developing Their Own Bitcoin Mining Chip,coindoo.com,954956,https://cryptopanic.com/news/954956/Samsung-is-Developing-Their-Own-Bitcoin-Mining-Chip
2018-02-01 11:56:00,1,5,2,1,0,0,0,0,0,0,0,0,0,0,0,Investopedia,"Bitcoin Tumbles After India Promises to ""Eliminate"" Use of Cryptocurrencies in the ""Payment System""",investopedia.com,954681,https://cryptopanic.com/news/954681/Bitcoin-Tumbles-After-India-Promises-to-Eliminate-Use-of-Cryptocurrencies-in-the-Payment-System
2018-02-01 11:55:14,2,5,0,1,0,0,0,0,0,0,0,0,0,0,0,Bitcoin.com,Mobile Payment Company Square Launches In-app Bitcoin Buy/Sell Option,bitcoin.com,954680,https://cryptopanic.com/news/954680/Mobile-Payment-Company-Square-Launches-In-app-Bitcoin-BuySell-Option
2018-02-01 11:39:19,11,20,0,1,0,0,0,0,0,0,0,0,0,0,0,CoinTelegraph,India: Bitcoin Prices Drop As Media Misinterprets Govt’s Regulation Speech,cointelegraph.com,954561,https://cryptopanic.com/news/954561/India-Bitcoin-Prices-Drop-As-Media-Misinterprets-Govts-Regulation-Speech
2018-02-01 11:04:07,1,6,0,1,0,0,0,0,0,0,0,0,0,0,0,NewsBTC,Bitcoin Price Watch; Hedging The Dip,newsbtc.com,954222,https://cryptopanic.com/news/954222/Bitcoin-Price-Watch-Hedging-The-Dip
2018-02-01 10:27:05,5,16,0,1,0,0,0,0,0,0,0,0,0,0,0,CoinTelegraph,Square Cash App Releases Bitcoin Buy/Sell Option To Almost All Users,cointelegraph.com,954053,https://cryptopanic.com/news/954053/Square-Cash-App-Releases-Bitcoin-BuySell-Option-To-Almost-All-Users
2018-02-01 10:22:56,17,38,0,1,0,0,0,0,0,0,0,0,0,0,0,Coindoo,Sberbank Will Launch a Crypto Exchange in Zurich,coindoo.com,953980,https://cryptopanic.com/news/953980/Sberbank-Will-Launch-a-Crypto-Exchange-in-Zurich
2018-02-01 10:20:23.792684,2,4,0,1,0,0,1,0,0,0,0,0,0,0,0,r/btc Reddit,HitBTC - Will now trade Bitcoin Cash under symbol BCH instead of BCC.,r/btc,953930,https://cryptopanic.com/news/953930/HitBTC-Will-now-trade-Bitcoin-Cash-under-symbol-BCH-instead-of-BCC
2018-02-01 09:54:07,17,33,0,1,0,0,0,0,0,0,0,0,0,0,0,NewsBTC,Curbing Illegal Activities is Not a Crypto Clampdown in India,newsbtc.com,953732,https://cryptopanic.com/news/953732/Curbing-Illegal-Activities-is-Not-a-Crypto-Clampdown-in-India
2018-02-01 09:30:17,2,8,0,1,0,0,0,0,0,0,0,0,0,0,0,NewsBTC,Insurance Providers Venture into Cryptocurrency,newsbtc.com,953617,https://cryptopanic.com/news/953617/Insurance-Providers-Venture-into-Cryptocurrency
2018-02-01 09:24:30,7,13,3,1,0,0,0,0,0,0,0,0,0,0,0,Quartz,"India’s government wants to kill bitcoin, but it loves blockchain",qz.com,953512,https://cryptopanic.com/news/953512/Indias-government-wants-to-kill-bitcoin-but-it-loves-blockchain
2018-02-01 09:00:31,2,5,0,1,0,0,0,0,0,0,0,0,0,0,0,Bitcoinist,Square’s Cash App Helps Make Bitcoin More Accessible,bitcoinist.com,953556,https://cryptopanic.com/news/953556/Squares-Cash-App-Helps-Make-Bitcoin-More-Accessible
2018-02-01 07:41:10,2,6,0,1,0,0,0,0,0,0,0,0,0,0,0,AMBCrypto,Line Corp a popular messaging service company to launch cryptocurrency services,ambcrypto.com,952875,https://cryptopanic.com/news/952875/Line-Corp-a-popular-messaging-service-company-to-launch-cryptocurrency-services
2018-02-01 07:31:28,42,19,54,1,0,0,0,1,0,0,0,0,0,0,0,Quartz,Arun Jaitley has just killed India’s cryptocurrency party,qz.com,952797,https://cryptopanic.com/news/952797/Arun-Jaitley-has-just-killed-Indias-cryptocurrency-party
2018-02-01 07:20:32.950197,2,6,0,1,0,0,0,0,0,0,0,0,0,0,0,r/BitcoinMarkets Reddit,Cex.io registrations open again,r/BitcoinMarkets,952714,https://cryptopanic.com/news/952714/Cexio-registrations-open-again
2018-02-01 06:40:21,42,68,0,1,0,0,0,0,0,0,0,0,0,0,0,CryptoNinjas,Bittrex CEO: “We will have US Dollar Trading”,cryptoninjas.net,952471,https://cryptopanic.com/news/952471/Bittrex-CEO-We-will-have-US-Dollar-Trading
2018-02-01 06:00:04,4,7,1,1,0,0,0,0,0,0,0,0,0,0,0,AMBCrypto,Bitfury’s Crystal to up the security of Bitcoin blockchain,ambcrypto.com,952238,https://cryptopanic.com/news/952238/Bitfurys-Crystal-to-up-the-security-of-Bitcoin-blockchain
2018-02-01 03:00:46,4,3,14,1,0,0,1,0,0,0,0,0,0,0,0,Bitcoin.com,Search the Blockchain With Bitcoin.com’s New Block Explorer,bitcoin.com,951383,https://cryptopanic.com/news/951383/Search-the-Blockchain-With-Bitcoincoms-New-Block-Explorer
2018-02-01 01:38:09,2,4,1,1,1,1,0,1,1,1,1,0,0,0,0,CoinTelegraph,"Bitcoin, Ethereum, Bitcoin Cash, Ripple, Stellar, Litecoin, NEM, NEO, EOS: Price Analysis, Jan. 31",cointelegraph.com,950994,https://cryptopanic.com/news/950994/Bitcoin-Ethereum-Bitcoin-Cash-Ripple-Stellar-Litecoin-NEM-NEO-EOS-Price-Analysis-Jan-31
2018-02-01 00:42:39.138310,16,37,0,1,0,0,0,0,0,0,0,0,0,0,0,Reddit - cryptocurrency,"This is Huge and it's being almost ignored, this post would have skyrocketed Bitcoin a few years ago and would be #1 post. This guy is the Founder and CEO of Twitter, pinning this awesome post and intro to BTC for his millions of followers.",r/CryptoCurrency,950481,https://cryptopanic.com/news/950481/This-is-Huge-and-its-being-almost-ignored-this-post-would-have-skyrocketed-Bitcoin-a-few-years-ago-and-would-be-1-post-This-guy-is-the-Founder-and-CEO-of-Twitter-pinning-this-awesome-post-and-intro-to-BTC-for-his-millions-of-followers
2018-02-01 00:00:14,16,27,0,1,0,0,0,0,0,0,0,0,0,0,0,NewsBTC,South Korean Finance Minister Reiterates Stance: No Ban,newsbtc.com,950194,https://cryptopanic.com/news/950194/South-Korean-Finance-Minister-Reiterates-Stance-No-Ban
2018-01-31 22:00:48.729631,2,12,3,1,0,0,0,0,0,0,0,0,0,0,0,r/Bitcoin Reddit,Who feels better after seeing this ? ;),r/Bitcoin,949216,https://cryptopanic.com/news/949216/Who-feels-better-after-seeing-this
2018-01-31 21:05:11,11,15,0,1,0,0,0,0,0,0,0,0,0,0,0,Live Bitcoin News,South Korea’s Wemakeprice Prepares to Integrate Cryptocurrency Payments,livebitcoinnews.com,948792,https://cryptopanic.com/news/948792/South-Koreas-Wemakeprice-Prepares-to-Integrate-Cryptocurrency-Payments
2018-01-31 20:36:42,19,32,0,1,0,0,0,0,0,0,0,0,0,0,0,CoinTelegraph,Russia’s Largest State Bank To Open Cryptocurrency Exchange In Europe,cointelegraph.com,948656,https://cryptopanic.com/news/948656/Russias-Largest-State-Bank-To-Open-Cryptocurrency-Exchange-In-Europe
2018-01-31 20:17:57,28,53,0,1,0,0,0,0,0,0,0,0,0,0,0,Bitcoin.com,South Korean Court Rules Bitcoin Has Economic Value,bitcoin.com,948394,https://cryptopanic.com/news/948394/South-Korean-Court-Rules-Bitcoin-Has-Economic-Value
2018-01-31 19:59:44,1,2,12,1,0,0,0,0,0,0,0,0,0,0,0,Trustnodes,“Our Collective Thoughts” Are a Bitcoin Ban is Desirable Says Netherlands’ Finance Minister,trustnodes.com,948270,https://cryptopanic.com/news/948270/Our-Collective-Thoughts-Are-a-Bitcoin-Ban-is-Desirable-Says-Netherlands-Finance-Minister
2018-01-31 19:43:08,1,7,1,1,0,0,0,0,0,0,0,0,0,0,0,CoinTelegraph,"Goldman Sachs Is Not Starting A Crypto Trading Desk, But They Did Invest In One",cointelegraph.com,948118,https://cryptopanic.com/news/948118/Goldman-Sachs-Is-Not-Starting-A-Crypto-Trading-Desk-But-They-Did-Invest-In-One
2018-01-31 19:00:05,1,5,0,1,0,0,0,0,0,0,0,0,0,0,0,Bitcoinist,Turkish Football Team Buys Player With Bitcoin,bitcoinist.com,947952,https://cryptopanic.com/news/947952/Turkish-Football-Team-Buys-Player-With-Bitcoin
2018-01-31 17:15:47.717539,27,35,1,1,1,0,0,0,0,0,0,0,0,0,0,Reddit - cryptocurrency,Ethereum and Bitcoin appear to be separating. ETH is in a 14 day uptrend while BTC is still in a 25 day downtrend.,r/CryptoCurrency,946709,https://cryptopanic.com/news/946709/Ethereum-and-Bitcoin-appear-to-be-separating-ETH-is-in-a-14-day-uptrend-while-BTC-is-still-in-a-25-day-downtrend
2018-01-31 15:52:12,3,7,1,1,0,0,0,0,0,0,0,0,0,0,0,Coindoo,191 Bitcoin Confiscated by South Korean Authorities,coindoo.com,945950,https://cryptopanic.com/news/945950/191-Bitcoin-Confiscated-by-South-Korean-Authorities
2018-01-31 15:51:41,22,51,0,1,0,0,0,0,0,0,0,0,0,0,0,CoinTelegraph,South Korea Finance Minister Confirms ‘No Ban’ On Cryptocurrency,cointelegraph.com,945954,https://cryptopanic.com/news/945954/South-Korea-Finance-Minister-Confirms-No-Ban-On-Cryptocurrency
2018-01-31 15:05:46,6,16,0,1,0,0,0,0,0,0,0,0,0,0,0,Live Bitcoin News,Former US Senator: Bitcoin Could ‘Alter the World’ and ‘Neuter’ Central Banks,livebitcoinnews.com,945403,https://cryptopanic.com/news/945403/Former-US-Senator-Bitcoin-Could-Alter-the-World-and-Neuter-Central-Banks
2018-01-31 14:55:39,0,7,0,1,0,0,0,0,0,0,0,0,0,0,0,Bitcoin.com,Number of People Looking for Crypto-Careers Increased 10-Fold in 2017,bitcoin.com,945319,https://cryptopanic.com/news/945319/Number-of-People-Looking-for-Crypto-Careers-Increased-10-Fold-in-2017
2018-01-31 14:44:23,0,9,0,1,0,0,0,0,0,0,0,0,0,0,0,Coindoo,The Japanese Company LINE Has Launched Its Own Crypto Exchange,coindoo.com,945228,https://cryptopanic.com/news/945228/The-Japanese-Company-LINE-Has-Launched-Its-Own-Crypto-Exchange
2018-01-31 14:43:40,1,7,0,1,0,0,0,0,0,0,0,0,0,0,0,CoinTelegraph,"Venezuela Says Crypto Mining Now ‘Perfectly Legal,’ Announces Petro Presale",cointelegraph.com,945231,https://cryptopanic.com/news/945231/Venezuela-Says-Crypto-Mining-Now-Perfectly-Legal-Announces-Petro-Presale
2018-01-31 13:49:34,3,20,0,1,1,0,0,0,0,0,0,0,0,0,0,Trustnodes,Ethereum’s Bitcoin Ratio Rises to Its Highest Level in Months,trustnodes.com,944740,https://cryptopanic.com/news/944740/Ethereums-Bitcoin-Ratio-Rises-to-Its-Highest-Level-in-Months
2018-01-31 13:39:00,10,2,8,1,0,0,0,0,0,0,0,0,0,0,0,Coin Idol,"A Subpoena to Bitfinex and Tether Made Bitcoin Price Fall Under $10,000 Threshold",coinidol.com,944622,https://cryptopanic.com/news/944622/A-Subpoena-to-Bitfinex-and-Tether-Made-Bitcoin-Price-Fall-Under-10000-Threshold
2018-01-31 13:01:39,6,9,2,1,0,0,0,0,0,0,0,0,0,0,0,Bitcoin.com,South Korea Finds Nearly $600 Million in Crypto Crime,bitcoin.com,944404,https://cryptopanic.com/news/944404/South-Korea-Finds-Nearly-600-Million-in-Crypto-Crime
2018-01-31 11:50:19.885471,4,7,0,1,0,0,0,0,0,0,0,0,0,0,0,r/BitcoinMarkets Reddit,We now accept lightning payments (on testnet)!,r/BitcoinMarkets,943830,https://cryptopanic.com/news/943830/We-now-accept-lightning-payments-on-testnet
2018-01-31 11:22:46,4,8,0,1,0,0,1,0,0,0,0,0,0,0,0,Trustnodes,Decentralized eBay OpenBazaar Adds Bitcoin Cash and Zcash Payments,trustnodes.com,943677,https://cryptopanic.com/news/943677/Decentralized-eBay-OpenBazaar-Adds-Bitcoin-Cash-and-Zcash-Payments
2018-01-31 11:08:43,46,86,0,1,0,0,0,0,0,0,0,0,0,0,0,Coindoo,"South Korea Will Not Ban the Cryptocurrency Trading, argued The Finance Minister",coindoo.com,943609,https://cryptopanic.com/news/943609/South-Korea-Will-Not-Ban-the-Cryptocurrency-Trading-argued-The-Finance-Minister
2018-01-31 10:26:59,15,30,0,1,0,0,0,0,0,0,0,0,0,0,0,Coinspeaker,CoinMarketCap Brings South Korean Exchanges Back Into Its Price Index,coinspeaker.com,943498,https://cryptopanic.com/news/943498/CoinMarketCap-Brings-South-Korean-Exchanges-Back-Into-Its-Price-Index
2018-01-31 10:00:01,7,6,5,1,0,0,0,0,0,0,0,0,0,0,0,NewsBTC,South Korean Officials Discover $600m Worth of Cryptocurrency Crimes,newsbtc.com,943219,https://cryptopanic.com/news/943219/South-Korean-Officials-Discover-600m-Worth-of-Cryptocurrency-Crimes
2018-01-31 09:49:47,5,9,1,1,1,0,0,0,0,0,0,0,0,0,0,Coindoo,"“The U.S. Will be Our Focus”, said the Huobi’s Chief Strategy Officer",coindoo.com,943104,https://cryptopanic.com/news/943104/The-US-Will-be-Our-Focus-said-the-Huobis-Chief-Strategy-Officer
2018-01-31 08:58:29,7,7,0,1,1,0,0,0,0,0,0,0,0,0,0,Bitcoin.com,Venezuela Announces Whitepaper and Pre-Sale of Its Oil-Backed Cryptocurrency Petro,bitcoin.com,942837,https://cryptopanic.com/news/942837/Venezuela-Announces-Whitepaper-and-Pre-Sale-of-Its-Oil-Backed-Cryptocurrency-Petro
2018-01-31 08:26:05,3,13,0,1,1,0,0,0,0,0,0,0,0,0,0,Quartz,Goldman Sachs inadvertently bought a stake in a bitcoin trading desk,qz.com,942709,https://cryptopanic.com/news/942709/Goldman-Sachs-inadvertently-bought-a-stake-in-a-bitcoin-trading-desk
2018-01-31 07:44:29,4,7,2,1,0,0,0,0,0,0,0,0,0,0,0,AMBCrypto,Tether and Bitfinex subpoena causes Bitcoin and other altcoins to tumble,ambcrypto.com,942787,https://cryptopanic.com/news/942787/Tether-and-Bitfinex-subpoena-causes-Bitcoin-and-other-altcoins-to-tumble
2018-01-31 07:00:26,5,11,0,1,0,0,0,0,0,0,0,0,0,0,0,Bitcoin.com,Sberbank to Bypass Russian Regulations and Trade Cryptocurrencies Overseas,bitcoin.com,942215,https://cryptopanic.com/news/942215/Sberbank-to-Bypass-Russian-Regulations-and-Trade-Cryptocurrencies-Overseas
2018-01-31 06:21:56,3,6,0,1,0,0,0,0,0,0,0,0,0,0,0,Cointia,UK’s The Royal Mint Now Allows Anyone to Invest in Gold through its Own Token,cointia.com,941983,https://cryptopanic.com/news/941983/UKs-The-Royal-Mint-Now-Allows-Anyone-to-Invest-in-Gold-through-its-Own-Token
2018-01-31 05:59:15,10,18,0,1,0,0,0,0,0,0,0,0,0,0,0,Cointia,"Samsung to Enter Bitcoin Mining Industry, Set to Mass Produce ASIC Miners this January",cointia.com,941866,https://cryptopanic.com/news/941866/Samsung-to-Enter-Bitcoin-Mining-Industry-Set-to-Mass-Produce-ASIC-Miners-this-January
2018-01-31 04:08:50,0,0,6,1,0,0,1,0,0,0,0,0,0,0,0,NewsBTC,Bitcoin Cash Price Technical Analysis – BCH/USD Crashes Below $1500,newsbtc.com,941247,https://cryptopanic.com/news/941247/Bitcoin-Cash-Price-Technical-Analysis-BCHUSD-Crashes-Below-1500
2018-01-31 03:48:45,17,22,0,1,0,0,0,0,0,0,0,0,0,0,0,Quartz,Japan’s biggest chat app is launching a cryptocurrency exchange,qz.com,941093,https://cryptopanic.com/news/941093/Japans-biggest-chat-app-is-launching-a-cryptocurrency-exchange
2018-01-31 02:54:56,2,8,0,1,0,0,0,0,0,0,0,0,0,0,0,AMBCrypto,Is Bitcoin becoming safer? – a survey,ambcrypto.com,940792,https://cryptopanic.com/news/940792/Is-Bitcoin-becoming-safer-a-survey
2018-01-31 02:30:46,7,18,0,1,0,0,0,0,0,0,0,0,0,0,0,Bitcoin.com,Chinese Investors Continue to Obtain Bitcoin Using Thriving OTC Platforms,bitcoin.com,940542,https://cryptopanic.com/news/940542/Chinese-Investors-Continue-to-Obtain-Bitcoin-Using-Thriving-OTC-Platforms
2018-01-31 00:45:33,3,7,4,1,0,0,0,0,0,0,0,0,0,0,0,CoinTelegraph,Is Bitcoin’s Reign as King of Cryptocurrency in Danger?,cointelegraph.com,939779,https://cryptopanic.com/news/939779/Is-Bitcoins-Reign-as-King-of-Cryptocurrency-in-Danger
2018-01-30 23:30:11,5,0,6,1,0,0,0,0,0,0,0,0,0,0,0,BTC Manager,Bitfinex and Tether Receive U.S. Subpoenas (How is a USDT made?),btcmanager.com,939773,https://cryptopanic.com/news/939773/Bitfinex-and-Tether-Receive-US-Subpoenas-How-is-a-USDT-made
2018-01-30 23:00:48,5,5,0,1,0,0,0,0,0,0,0,0,0,0,0,Bitcoinist,Here’s What The South Korean Regulations Mean For The Cryptocurrency Market,bitcoinist.com,939076,https://cryptopanic.com/news/939076/Heres-What-The-South-Korean-Regulations-Mean-For-The-Cryptocurrency-Market
2018-01-30 22:20:21.433258,2,7,0,1,0,0,0,0,0,0,0,0,0,0,0,r/Bitcoin Reddit,"There may actually be negative fees to use Lightning sometimes, if your transaction helps others avoid hitting the blockchain to rebalance channels. ;)",r/Bitcoin,938489,https://cryptopanic.com/news/938489/There-may-actually-be-negative-fees-to-use-Lightning-sometimes-if-your-transaction-helps-others-avoid-hitting-the-blockchain-to-rebalance-channels
2018-01-30 22:20:21.256955,7,20,7,1,0,0,0,0,0,0,0,0,0,0,0,r/Bitcoin Reddit,"Facebook bans all advertising related to Bitcoin, ICOs and other cryptos.",r/Bitcoin,938488,https://cryptopanic.com/news/938488/Facebook-bans-all-advertising-related-to-Bitcoin-ICOs-and-other-cryptos
2018-01-30 21:30:45,0,4,1,1,0,0,1,0,0,0,0,0,0,0,0,Live Bitcoin News,New OpenBazaar Version Officially Supports Bitcoin Cash and ZCash,livebitcoinnews.com,938128,https://cryptopanic.com/news/938128/New-OpenBazaar-Version-Officially-Supports-Bitcoin-Cash-and-ZCash
2018-01-30 21:00:50,4,2,5,1,0,0,0,0,0,0,0,0,0,0,0,NewsBTC,Ransomware Creators Having Funds Stolen; Victims Locked Out,newsbtc.com,937955,https://cryptopanic.com/news/937955/Ransomware-Creators-Having-Funds-Stolen-Victims-Locked-Out
2018-01-30 21:00:47.471177,4,1,1,1,0,0,1,0,0,0,0,0,0,0,0,r/btc Reddit,"Bitcoin Tumbles Towards $10k After Bitfinex, Tether Subpoena'd",r/btc,937820,https://cryptopanic.com/news/937820/Bitcoin-Tumbles-Towards-10k-After-Bitfinex-Tether-Subpoenad
2018-01-30 20:29:51,15,15,20,1,0,0,0,0,0,0,0,0,0,0,0,CoinTelegraph,"Facebook Bans Cryptocurrency, ICO Ads Because Of ‘Deceptive Promotional Practices’",cointelegraph.com,937644,https://cryptopanic.com/news/937644/Facebook-Bans-Cryptocurrency-ICO-Ads-Because-Of-Deceptive-Promotional-Practices
2018-01-30 19:52:13,5,30,2,1,0,0,0,0,0,0,0,0,0,0,0,CryptoPost,Bitcoin At The Massive Psychological Support,cryptopost.com,937214,https://cryptopanic.com/news/937214/Bitcoin-At-The-Massive-Psychological-Support
2018-01-30 19:50:55,9,1,15,1,0,0,0,0,0,0,0,1,0,0,0,Bitcoin.com,U.S. Regulators Send Tether and Bitfinex Subpoenas,bitcoin.com,937212,https://cryptopanic.com/news/937212/US-Regulators-Send-Tether-and-Bitfinex-Subpoenas
2018-01-30 19:30:42,3,5,0,1,0,1,0,0,0,0,0,0,0,0,0,Bitcoin.com,Nassim Nicholas Taleb vs David Birch on The Bitcoin Standard,bitcoin.com,937019,https://cryptopanic.com/news/937019/Nassim-Nicholas-Taleb-vs-David-Birch-on-The-Bitcoin-Standard
2018-01-30 19:10:21.732520,3,4,2,1,0,0,1,0,0,0,0,0,0,0,0,r/btc Reddit,Bitcoin Cash support on OpenBazaar now live,r/btc,936727,https://cryptopanic.com/news/936727/Bitcoin-Cash-support-on-OpenBazaar-now-live
2018-01-30 19:00:05,33,9,50,1,0,0,0,0,0,0,0,0,0,0,0,Trustnodes,Bitfinex and Tether Subpoenaed by US Regulators,trustnodes.com,936674,https://cryptopanic.com/news/936674/Bitfinex-and-Tether-Subpoenaed-by-US-Regulators
2018-01-30 18:58:39,0,0,7,1,0,0,0,0,0,0,0,0,0,0,0,CryptoNinjas,Romania’s BTCxChange will discontinue exchange to bank transfers,cryptoninjas.net,936672,https://cryptopanic.com/news/936672/Romanias-BTCxChange-will-discontinue-exchange-to-bank-transfers
2018-01-30 18:50:07.781553,3,8,0,1,0,0,1,0,0,0,0,0,0,0,0,Bitcoin Cash Reddit,"NY restaurant accepts Bitcoin Cash and other cryptos, but rejects Visa and Mastercard",r/Bitcoincash,936471,https://cryptopanic.com/news/936471/NY-restaurant-accepts-Bitcoin-Cash-and-other-cryptos-but-rejects-Visa-and-Mastercard
2018-01-30 18:20:20.197609,77,15,102,1,0,0,0,0,0,0,0,0,0,0,0,r/BitcoinMarkets Reddit,"U.S. Regulators to Subpoena Crypto Exchange Bitfinex, Tether",r/BitcoinMarkets,936104,https://cryptopanic.com/news/936104/US-Regulators-to-Subpoena-Crypto-Exchange-Bitfinex-Tether
2018-01-30 18:10:16,0,0,6,1,0,0,0,0,0,0,0,0,0,0,0,NewsBTC,Bitcoin Price Watch; Trading The Downside Action,newsbtc.com,935992,https://cryptopanic.com/news/935992/Bitcoin-Price-Watch-Trading-The-Downside-Action
2018-01-30 17:58:00,0,1,10,1,0,0,0,0,0,0,0,0,0,0,0,Coin Idol,The Crime Scene: Over Half of Bitcoin Transactions are Used for Illegal Purposes,coinidol.com,935764,https://cryptopanic.com/news/935764/The-Crime-Scene-Over-Half-of-Bitcoin-Transactions-are-Used-for-Illegal-Purposes
