published_at,important,positive,negative,BTC,ETH,XRP,BCH,LTC,XLM,EOS,NEO,MIOTA,DASH,XMR,VEN,source,title,domain,id,url
2018-03-09 15:32:04,6,7,0,1,0,0,0,0,0,0,0,0,0,0,0,Bitcoin.com,Wirex Launching Bitcoin Debit Cards in Europe,bitcoin.com,1326794,https://cryptopanic.com/news/1326794/Wirex-Launching-Bitcoin-Debit-Cards-in-Europe
2018-03-09 14:20:00,5,5,3,1,0,0,0,0,0,0,0,0,0,0,0,Investopedia,Bitcoin Price Tanks Amid SEC and CFTC Crackdown on Cryptocurrencies,investopedia.com,1325970,https://cryptopanic.com/news/1325970/Bitcoin-Price-Tanks-Amid-SEC-and-CFTC-Crackdown-on-Cryptocurrencies
2018-03-09 13:31:25,1,5,0,1,0,0,0,0,0,0,0,0,0,0,0,CoinTelegraph,The Mess That Was Mt. Gox: Four Years On,cointelegraph.com,1325477,https://cryptopanic.com/news/1325477/The-Mess-That-Was-Mt-Gox-Four-Years-On
2018-03-09 13:13:58,14,24,0,1,1,1,1,1,0,0,0,0,0,0,0,AMBCrypto,"Grayscale offers new crypto funds for Ripple [XRP], Litecoin [LTC], Ethereum Classic [ETC] & Bitcoin Cash [BCH]",ambcrypto.com,1325102,https://cryptopanic.com/news/1325102/Grayscale-offers-new-crypto-funds-for-Ripple-XRP-Litecoin-LTC-Ethereum-Classic-ETC-Bitcoin-Cash-BCH
2018-03-09 13:03:42,3,1,3,1,0,0,0,0,0,0,0,0,0,0,0,Cryptovest,"Chinese Crypto Exchanges Blocked, Bitcoin Price Suffers Another Setback",cryptovest.com,1325056,https://cryptopanic.com/news/1325056/Chinese-Crypto-Exchanges-Blocked-Bitcoin-Price-Suffers-Another-Setback
2018-03-09 12:30:53,3,6,0,1,0,0,0,0,0,0,0,0,0,0,0,Bitcoinist,Former CFTC Chair: Cryptocurrency Bubble Is Nowhere Near Bursting,bitcoinist.com,1324761,https://cryptopanic.com/news/1324761/Former-CFTC-Chair-Cryptocurrency-Bubble-Is-Nowhere-Near-Bursting
2018-03-09 12:06:02,3,1,10,1,0,0,0,0,0,0,0,0,0,0,0,Coindoo,Crypto Exchanges Blocked in China After Binance Hack,coindoo.com,1324485,https://cryptopanic.com/news/1324485/Crypto-Exchanges-Blocked-in-China-After-Binance-Hack
2018-03-09 11:38:40,8,16,0,1,0,0,0,0,0,0,0,0,0,0,0,CoinJournal,Bitcoin Core 0.16.0 – Full Segwit capabilities are here.,coinjournal.net,1324148,https://cryptopanic.com/news/1324148/Bitcoin-Core-0160-Full-Segwit-capabilities-are-here
2018-03-09 11:35:57,1,5,0,1,0,0,0,0,0,0,0,0,0,0,0,CoinGape,PBOC Disallows Bitcoin Payments But Interested In Digital Currency,coingape.com,1324149,https://cryptopanic.com/news/1324149/PBOC-Disallows-Bitcoin-Payments-But-Interested-In-Digital-Currency
2018-03-09 11:09:54,4,7,0,1,0,0,0,0,0,0,0,0,0,1,0,Quartz,A new report says Egypt is secretly forcing citizens to mine cryptocurrency,qz.com,1323893,https://cryptopanic.com/news/1323893/A-new-report-says-Egypt-is-secretly-forcing-citizens-to-mine-cryptocurrency
2018-03-09 10:57:06,5,7,0,1,0,0,0,0,0,0,0,0,0,1,0,Use The Bitcoin,Best Mining Alternatives To MinerGate,usethebitcoin.com,1323788,https://cryptopanic.com/news/1323788/Best-Mining-Alternatives-To-MinerGate
2018-03-09 10:50:48,2,8,2,1,0,0,0,0,0,0,0,0,0,0,0,CoinTelegraph,"Hacked Coincheck Exchange Will Refund Users, Resume Trading ‘Next Week’, Says CEO",cointelegraph.com,1323782,https://cryptopanic.com/news/1323782/Hacked-Coincheck-Exchange-Will-Refund-Users-Resume-Trading-Next-Week-Says-CEO
2018-03-09 10:00:44,0,6,1,1,1,1,0,0,0,0,0,0,0,0,0,Bitcoin.com,Cryptocurrency Interest Wanes — Online Searches for “Bitcoin” Drop 80%,bitcoin.com,1323367,https://cryptopanic.com/news/1323367/Cryptocurrency-Interest-Wanes-Online-Searches-for-Bitcoin-Drop-80
2018-03-09 09:30:56,3,5,0,1,1,1,1,0,0,0,0,0,0,0,0,CryptoDaily,"Grayscale Adds Ripple XRP, Litecoin, Ethereum, & BCH To Its Investment Trust",cryptodaily.co.uk,1323029,https://cryptopanic.com/news/1323029/Grayscale-Adds-Ripple-XRP-Litecoin-Ethereum-BCH-To-Its-Investment-Trust
2018-03-09 09:11:19,5,11,4,1,0,0,1,0,0,0,0,0,0,0,0,Trustnodes,"Newegg, Namecheap, 100,000 Merchants Start Accepting Bitcoin Cash",trustnodes.com,1322895,https://cryptopanic.com/news/1322895/Newegg-Namecheap-100000-Merchants-Start-Accepting-Bitcoin-Cash
2018-03-09 09:00:14,5,6,0,1,0,0,0,0,0,0,0,0,0,0,0,NewsBTC,"Was Mt. Gox the Major Factor Behind Bitcoin’s $1,000 Drop",newsbtc.com,1322808,https://cryptopanic.com/news/1322808/Was-Mt-Gox-the-Major-Factor-Behind-Bitcoins-1000-Drop
2018-03-09 07:20:19.560452,61,24,8,1,0,0,0,0,0,0,0,0,0,0,0,Reddit - cryptocurrency,It's time we as a community moved away from Bitcoin,r/CryptoCurrency,1321846,https://cryptopanic.com/news/1321846/Its-time-we-as-a-community-moved-away-from-Bitcoin
2018-03-09 03:05:41,3,5,1,1,1,0,0,1,0,0,0,0,0,0,0,Bitcoin.com,Poll Suggests Young Romanians Want to Pay with Crypto,bitcoin.com,1319511,https://cryptopanic.com/news/1319511/Poll-Suggests-Young-Romanians-Want-to-Pay-with-Crypto
2018-03-08 23:28:50,4,7,0,1,0,0,0,0,0,0,0,0,0,0,0,Bitcoin.com,Bithumb Launching Kiosks at Restaurants for Food Orders and Crypto Payments in Korea,bitcoin.com,1317723,https://cryptopanic.com/news/1317723/Bithumb-Launching-Kiosks-at-Restaurants-for-Food-Orders-and-Crypto-Payments-in-Korea
2018-03-08 20:00:02,2,5,3,1,0,0,0,0,0,0,0,0,0,0,0,CryptoDaily,Will SegWit Save Bitcoin?,cryptodaily.co.uk,1316135,https://cryptopanic.com/news/1316135/Will-SegWit-Save-Bitcoin
2018-03-08 19:28:39,6,8,0,1,0,0,0,0,0,0,0,0,0,0,0,Use The Bitcoin,CryptoHex: Indestructible Way To Backup Your Cryptocurrencies,usethebitcoin.com,1315734,https://cryptopanic.com/news/1315734/CryptoHex-Indestructible-Way-To-Backup-Your-Cryptocurrencies
2018-03-08 19:24:19,3,7,0,1,0,0,1,1,0,0,0,0,0,0,0,Live Bitcoin News,Gemini Exchange may add Bitcoin Cash and Litecoin Soon,livebitcoinnews.com,1315728,https://cryptopanic.com/news/1315728/Gemini-Exchange-may-add-Bitcoin-Cash-and-Litecoin-Soon
2018-03-08 19:20:22.526841,15,32,4,1,0,0,1,0,0,0,0,0,0,0,0,r/btc Reddit,Let's help Twitter understand that the @Bitcoin account is not impersonating anyone since it's impossible to impersonate Bitcoin (retweet this or post your own tweet to Jack and TwitterSupport),r/btc,1315639,https://cryptopanic.com/news/1315639/Lets-help-Twitter-understand-that-the-Bitcoin-account-is-not-impersonating-anyone-since-its-impossible-to-impersonate-Bitcoin-retweet-this-or-post-your-own-tweet-to-Jack-and-TwitterSupport
2018-03-08 18:55:19,1,7,0,1,1,0,0,0,0,0,0,0,0,1,0,Bitcoin.com,New Player Asrock Said to Enter the GPU Mining Market,bitcoin.com,1315368,https://cryptopanic.com/news/1315368/New-Player-Asrock-Said-to-Enter-the-GPU-Mining-Market
2018-03-08 17:45:28,20,22,0,1,1,0,0,0,0,0,0,0,0,0,0,AMBCrypto,"What will happen to Bitcoin [BTC], Ethereum [ETH] and other cryptos – An AMBCrypto sentimental data study!",ambcrypto.com,1314500,https://cryptopanic.com/news/1314500/What-will-happen-to-Bitcoin-BTC-Ethereum-ETH-and-other-cryptos-An-AMBCrypto-sentimental-data-study
2018-03-08 16:35:00,5,3,12,1,0,0,0,0,0,0,0,0,0,0,0,Bitcoin.com,Chinese Internet Regulators Block Cryptocurrency Exchanges on Social Media,bitcoin.com,1313469,https://cryptopanic.com/news/1313469/Chinese-Internet-Regulators-Block-Cryptocurrency-Exchanges-on-Social-Media
2018-03-08 14:50:17.398814,24,42,0,1,0,0,0,0,0,0,0,0,0,0,0,r/Bitcoin Reddit,Market crashes being caused by Mt Gox trustee is possibly the most bullish news we've ever encountered,r/Bitcoin,1312132,https://cryptopanic.com/news/1312132/Market-crashes-being-caused-by-Mt-Gox-trustee-is-possibly-the-most-bullish-news-weve-ever-encountered
2018-03-08 13:27:52,0,10,0,1,0,0,0,0,0,0,0,0,0,0,0,CryptoDaily,Bitcoin To Replace The Dollar And Gold?,cryptodaily.co.uk,1311278,https://cryptopanic.com/news/1311278/Bitcoin-To-Replace-The-Dollar-And-Gold
2018-03-08 12:00:30,0,5,0,1,1,0,0,0,0,0,0,0,0,0,0,Bitcoinist,Ethereum & Bitcoin Price Expected to See Triple-Digit Gains in 2018,bitcoinist.com,1310679,https://cryptopanic.com/news/1310679/Ethereum-Bitcoin-Price-Expected-to-See-Triple-Digit-Gains-in-2018
2018-03-08 11:36:50,14,27,2,1,1,0,0,0,0,0,0,0,0,0,0,Live Bitcoin News,"Study: Bitcoin to Hit $29,000 by Year’s End, Ethereum’s Market Cap to Triple",livebitcoinnews.com,1310089,https://cryptopanic.com/news/1310089/Study-Bitcoin-to-Hit-29000-by-Years-End-Ethereums-Market-Cap-to-Triple
2018-03-08 11:01:52,7,13,11,1,0,0,0,0,0,0,0,0,0,0,0,Cryptovest,"Bitcoin “A Lot More Likely” to See $100 than $100,000, Says Harvard Professor",cryptovest.com,1309835,https://cryptopanic.com/news/1309835/Bitcoin-A-Lot-More-Likely-to-See-100-than-100000-Says-Harvard-Professor
2018-03-08 10:21:29,10,20,0,1,0,0,0,0,0,0,0,0,0,0,0,Use The Bitcoin,Wealthy Investors Moving Towards the Cryptocurrency Market,usethebitcoin.com,1309518,https://cryptopanic.com/news/1309518/Wealthy-Investors-Moving-Towards-the-Cryptocurrency-Market
2018-03-08 10:00:59,16,27,3,1,0,1,0,0,0,0,0,0,0,0,0,NewsBTC,Will Ripple be Bigger than Bitcoin? Experts Say Yes,newsbtc.com,1309516,https://cryptopanic.com/news/1309516/Will-Ripple-be-Bigger-than-Bitcoin-Experts-Say-Yes
2018-03-08 09:00:43,5,5,0,1,1,0,0,0,0,0,0,0,0,0,0,Bitcoin.com,Research Paper Says Issuers of ICO Tokens Will Face Class Action Lawsuits,bitcoin.com,1308874,https://cryptopanic.com/news/1308874/Research-Paper-Says-Issuers-of-ICO-Tokens-Will-Face-Class-Action-Lawsuits
2018-03-08 08:48:23,27,37,0,1,0,0,0,0,0,0,0,0,0,0,0,AMBCrypto,How Binance saved the day and CZ’s guidelines on how to trade safe!,ambcrypto.com,1308713,https://cryptopanic.com/news/1308713/How-Binance-saved-the-day-and-CZs-guidelines-on-how-to-trade-safe
2018-03-08 08:00:38,14,24,4,1,0,1,0,0,0,0,0,0,0,0,0,Bitcoinist,Experts Claim Ripple Could be the Next Bitcoin,bitcoinist.com,1308657,https://cryptopanic.com/news/1308657/Experts-Claim-Ripple-Could-be-the-Next-Bitcoin
2018-03-08 05:11:32,5,13,2,1,0,0,0,0,0,0,0,0,0,0,0,NewsBTC,Bitcoin Takes a Dip as SEC Demands Exchanges to Register,newsbtc.com,1307025,https://cryptopanic.com/news/1307025/Bitcoin-Takes-a-Dip-as-SEC-Demands-Exchanges-to-Register
2018-03-07 20:03:36,3,12,2,1,0,0,0,0,0,0,0,0,0,1,0,Bitcoin.com,Domains Running Cryptocurrency Mining Scripts Surge 725 Percent,bitcoin.com,1316950,https://cryptopanic.com/news/1316950/Domains-Running-Cryptocurrency-Mining-Scripts-Surge-725-Percent
2018-03-07 18:50:00,3,2,13,1,0,1,0,0,0,0,0,0,0,0,0,Investopedia,Bitcoin Price Tumbles Below $10k As SEC Says Crypto Exchanges Must Register With Agency,investopedia.com,1314333,https://cryptopanic.com/news/1314333/Bitcoin-Price-Tumbles-Below-10k-As-SEC-Says-Crypto-Exchanges-Must-Register-With-Agency
2018-03-07 15:12:33,11,1,1,1,0,0,0,0,0,0,0,0,0,0,0,AMBCrypto,Russian law to criminalize the use of Bitcoin or cryptocurrencies as money surrogate,ambcrypto.com,1313273,https://cryptopanic.com/news/1313273/Russian-law-to-criminalize-the-use-of-Bitcoin-or-cryptocurrencies-as-money-surrogate
2018-03-07 08:53:39,5,4,0,1,1,0,1,1,0,0,0,0,0,0,0,Trustnodes,"Coinbase Launches Index Fund Tracking Ethereum, Bitcoin, Bitcoin Cash and Litecoin",trustnodes.com,1309934,https://cryptopanic.com/news/1309934/Coinbase-Launches-Index-Fund-Tracking-Ethereum-Bitcoin-Bitcoin-Cash-and-Litecoin
2018-03-06 16:55:09,18,16,9,1,0,0,0,1,0,0,0,0,0,0,0,AMBCrypto,Will Litecoin [LTC] ride the wave to a bullish market or will it fall further?,ambcrypto.com,1302630,https://cryptopanic.com/news/1302630/Will-Litecoin-LTC-ride-the-wave-to-a-bullish-market-or-will-it-fall-further
2018-03-06 16:31:49,5,8,9,1,0,0,0,0,0,0,0,0,0,1,0,Live Bitcoin News,"Harvard Economist: Bitcoin More Likely to Hit $100 in 10 Years Not $100,000",livebitcoinnews.com,1302428,https://cryptopanic.com/news/1302428/Harvard-Economist-Bitcoin-More-Likely-to-Hit-100-in-10-Years-Not-100000
2018-03-06 16:28:50,8,3,0,1,0,0,0,0,0,0,0,0,0,0,0,AMBCrypto,Only a 19% conversion – South Korean bank sends notice to all Bitcoin virtual account holders,ambcrypto.com,1302380,https://cryptopanic.com/news/1302380/Only-a-19-conversion-South-Korean-bank-sends-notice-to-all-Bitcoin-virtual-account-holders
2018-03-06 16:00:55,2,4,1,1,0,0,1,0,0,0,0,0,0,0,0,Bitcoin.com,How to Create Custom Bitcoin Cash Addresses With Vanitygen,bitcoin.com,1302079,https://cryptopanic.com/news/1302079/How-to-Create-Custom-Bitcoin-Cash-Addresses-With-Vanitygen
2018-03-06 15:50:22,17,15,0,1,0,0,1,0,0,0,0,0,1,0,0,AMBCrypto,"Bitbns adds BCH, DOGE, DASH and SC to its trading platform",ambcrypto.com,1301848,https://cryptopanic.com/news/1301848/Bitbns-adds-BCH-DOGE-DASH-and-SC-to-its-trading-platform
2018-03-06 15:30:38.251831,0,9,3,1,0,0,0,0,0,0,0,0,0,0,0,r/Bitcoin Reddit,"Bitcoin more likely to crash to $100 than see crazy growth - former IMF Chief Economist. But when you read his logic behind it, no place for FUD, as he obviously doesn't understand crypto",r/Bitcoin,1301567,https://cryptopanic.com/news/1301567/Bitcoin-more-likely-to-crash-to-100-than-see-crazy-growth-former-IMF-Chief-Economist-But-when-you-read-his-logic-behind-it-no-place-for-FUD-as-he-obviously-doesnt-understand-crypto
2018-03-06 14:44:59,8,3,1,1,0,0,0,0,0,0,0,0,0,0,0,AMBCrypto,"Auction on the seized 2,170 Bitcoins worth $25 Million – who wants some?",ambcrypto.com,1300758,https://cryptopanic.com/news/1300758/Auction-on-the-seized-2170-Bitcoins-worth-25-Million-who-wants-some
2018-03-06 14:10:27,2,6,0,1,0,0,0,0,0,0,0,0,0,0,0,Coindoo,San Francisco’s Citizens Can Now Buy Ice Cream With Bitcoins: See How,coindoo.com,1300716,https://cryptopanic.com/news/1300716/San-Franciscos-Citizens-Can-Now-Buy-Ice-Cream-With-Bitcoins-See-How
2018-03-06 14:00:02,10,17,0,1,0,0,0,0,0,1,0,0,1,1,0,Bitcoin.com,"South Korean Travel Site with Over 50,000 Hotels to Accept 12 Cryptocurrencies",bitcoin.com,1300587,https://cryptopanic.com/news/1300587/South-Korean-Travel-Site-with-Over-50000-Hotels-to-Accept-12-Cryptocurrencies
2018-03-06 12:53:35,8,12,0,1,0,0,0,0,0,0,0,0,0,0,0,Use The Bitcoin,Fat Taiwan Airline Accepts Bitcoin Payments for Plane Tickets,usethebitcoin.com,1299873,https://cryptopanic.com/news/1299873/Fat-Taiwan-Airline-Accepts-Bitcoin-Payments-for-Plane-Tickets
2018-03-06 11:26:15,11,16,0,1,0,0,0,0,0,0,0,0,0,0,0,CoinGape,SegWit Adoption Leads To 50% Cutdown In Bitcoin Withdrawal Fee,coingape.com,1299100,https://cryptopanic.com/news/1299100/SegWit-Adoption-Leads-To-50-Cutdown-In-Bitcoin-Withdrawal-Fee
2018-03-06 11:00:52,3,7,3,1,0,0,0,0,0,0,0,0,0,0,0,NewsBTC,"Harvard Economist Says Bitcoin is Likely to Reach $100 in 10 Years, But For the Wrong Reason",newsbtc.com,1298810,https://cryptopanic.com/news/1298810/Harvard-Economist-Says-Bitcoin-is-Likely-to-Reach-100-in-10-Years-But-For-the-Wrong-Reason
2018-03-06 07:32:11,1,6,0,1,0,0,0,0,0,0,0,0,0,0,0,Ethereum World News,Bitcoin Price Analysis: BTC/USD Trying to Sustain Its Breakout,ethereumworldnews.com,1297123,https://cryptopanic.com/news/1297123/Bitcoin-Price-Analysis-BTCUSD-Trying-to-Sustain-Its-Breakout
2018-03-06 03:43:00,3,7,29,1,0,0,1,0,0,0,0,0,0,0,0,Bitcoin Twitter,"Bitcoin Cash is the real Bitcoin, as envisioned by Satoshi Nakamoto. This peer-to-peer electronic cash system enabl…",@Bitcoin,1295561,https://cryptopanic.com/news/1295561/Bitcoin-Cash-is-the-real-Bitcoin-as-envisioned-by-Satoshi-Nakamoto-This-peer-to-peer-electronic-cash-system-enabl
2018-03-06 01:30:08,0,5,7,1,0,1,0,1,0,0,0,0,0,0,0,Bitcoin.com,Ripple Soars Then Plunges off Coinbase Rumors – Again,bitcoin.com,1294676,https://cryptopanic.com/news/1294676/Ripple-Soars-Then-Plunges-off-Coinbase-Rumors-Again
2018-03-06 01:05:09,3,9,32,1,0,0,1,0,0,0,0,0,0,0,0,Roger Ver,"""The vision of Satoshi Nakamoto lives on in the form of Bitcoin Cash"" 
- @CryptoStratz 

Learn more at…",@rogerkver,1294355,https://cryptopanic.com/news/1294355/The-vision-of-Satoshi-Nakamoto-lives-on-in-the-form-of-Bitcoin-Cash-CryptoStratz-Learn-more-at
2018-03-06 00:37:36,7,11,4,1,0,1,0,0,0,0,0,0,0,0,0,CoinTelegraph,Ripple CEO Talks Liquidity And Regulation: Ultimately Governments Aren’t Going Away,cointelegraph.com,1294214,https://cryptopanic.com/news/1294214/Ripple-CEO-Talks-Liquidity-And-Regulation-Ultimately-Governments-Arent-Going-Away
2018-03-05 17:14:23,10,8,0,1,1,0,0,0,0,0,0,0,0,0,0,AMBCrypto,"Vitalik Buterin, founder Ethereum and CZ, CEO Binance sick of twitter scammers changes profile names",ambcrypto.com,1289822,https://cryptopanic.com/news/1289822/Vitalik-Buterin-founder-Ethereum-and-CZ-CEO-Binance-sick-of-twitter-scammers-changes-profile-names
2018-03-05 17:00:55,4,7,0,1,0,0,0,0,0,0,0,0,0,0,0,Coindoo,Stratis Cryptocurrency Review: A Quick Explanation of The Coin,coindoo.com,1289861,https://cryptopanic.com/news/1289861/Stratis-Cryptocurrency-Review-A-Quick-Explanation-of-The-Coin
2018-03-05 15:20:22.179075,15,29,0,1,1,0,0,0,0,0,0,0,0,0,0,Reddit,"Bitcoin and Ethereum Now Available at 1,200 Australian Newsstands",r/ethereum,1288607,https://cryptopanic.com/news/1288607/Bitcoin-and-Ethereum-Now-Available-at-1200-Australian-Newsstands
2018-03-05 13:50:18.854742,2,6,0,1,0,0,0,0,0,0,0,0,0,0,0,r/Bitcoin Reddit,Another big step towards mainstream adoption: PayPal patenting a system for faster cryptocurrency transaction times,r/Bitcoin,1287383,https://cryptopanic.com/news/1287383/Another-big-step-towards-mainstream-adoption-PayPal-patenting-a-system-for-faster-cryptocurrency-transaction-times
2018-03-05 13:09:47,2,9,2,1,0,0,0,0,0,0,0,0,0,0,0,Coindoo,North Korea Funding Nuclear Weapons with Bitcoin,coindoo.com,1286919,https://cryptopanic.com/news/1286919/North-Korea-Funding-Nuclear-Weapons-with-Bitcoin
2018-03-05 12:37:01,9,12,0,1,1,0,0,0,0,0,0,0,0,0,0,Trustnodes,"Bitcoin, Ethereum Rises as Italy Delivers Shock Elections, Euro Falls, Meet M5S",trustnodes.com,1286653,https://cryptopanic.com/news/1286653/Bitcoin-Ethereum-Rises-as-Italy-Delivers-Shock-Elections-Euro-Falls-Meet-M5S
2018-03-05 12:30:02,5,11,1,1,0,0,0,0,0,0,0,0,0,0,0,NewsBTC,"Bank of England Says Cryptocurrencies Will Fall, With False Claims",newsbtc.com,1286652,https://cryptopanic.com/news/1286652/Bank-of-England-Says-Cryptocurrencies-Will-Fall-With-False-Claims
2018-03-05 11:17:38,21,32,0,1,0,0,0,1,0,0,0,0,0,0,0,CoinTelegraph,Member Of China’s Main Political Advisory Proposes National Crypto Trading Platform,cointelegraph.com,1285875,https://cryptopanic.com/news/1285875/Member-Of-Chinas-Main-Political-Advisory-Proposes-National-Crypto-Trading-Platform
2018-03-05 11:00:32,1,4,1,1,1,0,0,0,0,0,0,0,0,0,0,NewsBTC,Roger Ver Says Ethereum May Overtake Bitcoin in Market Cap,newsbtc.com,1285713,https://cryptopanic.com/news/1285713/Roger-Ver-Says-Ethereum-May-Overtake-Bitcoin-in-Market-Cap
2018-03-05 10:55:15,2,6,0,1,0,0,0,0,0,0,1,0,0,0,0,Bitcoin.com,This Week in Bitcoin: Courtroom Drama,bitcoin.com,1285710,https://cryptopanic.com/news/1285710/This-Week-in-Bitcoin-Courtroom-Drama
2018-03-05 10:07:17,14,20,0,1,0,0,0,0,0,0,0,0,0,0,0,Use The Bitcoin,Bitcoin Keeps Attracting Trillionaire Institutional Investors,usethebitcoin.com,1285271,https://cryptopanic.com/news/1285271/Bitcoin-Keeps-Attracting-Trillionaire-Institutional-Investors
2018-03-05 10:00:27,17,22,1,1,0,0,0,0,0,0,0,0,0,1,0,AMBCrypto,Bitcoin [BTC] still the second biggest gainer this week despite the sloth-like crawl,ambcrypto.com,1285241,https://cryptopanic.com/news/1285241/Bitcoin-BTC-still-the-second-biggest-gainer-this-week-despite-the-sloth-like-crawl
2018-03-05 08:50:30,3,4,3,1,0,0,0,0,0,0,0,0,0,0,0,Cryptovest,Tethers (USDT) Becoming Indispensable to Bitcoin Trading?,cryptovest.com,1284611,https://cryptopanic.com/news/1284611/Tethers-USDT-Becoming-Indispensable-to-Bitcoin-Trading
2018-03-05 06:50:11.571569,8,24,1,1,0,0,1,0,0,0,0,0,0,0,0,r/btc Reddit,"Germany Recognizes Bitcoin as Legal Tender, Updates Taxes. Germany’s Ministry of Finance published a guidance report on February 27th stating that they won't be taxing crypto users for using cryptocurrencies as a means of payment.",r/btc,1283575,https://cryptopanic.com/news/1283575/Germany-Recognizes-Bitcoin-as-Legal-Tender-Updates-Taxes-Germanys-Ministry-of-Finance-published-a-guidance-report-on-February-27th-stating-that-they-wont-be-taxing-crypto-users-for-using-cryptocurrencies-as-a-means-of-payment
2018-03-05 05:05:08.799087,35,16,27,1,0,0,1,0,0,0,0,0,0,0,0,Reddit - cryptocurrency,"Bitcoin Cash is a scamcoin. That's not just empty rhetoric. Here's the story, summarized.",r/CryptoCurrency,1282818,https://cryptopanic.com/news/1282818/Bitcoin-Cash-is-a-scamcoin-Thats-not-just-empty-rhetoric-Heres-the-story-summarized
2018-03-04 21:04:46.916986,1,2,4,1,0,0,1,0,0,0,0,0,0,0,0,Bitcoin Cash Reddit,Satoshi’s Vision Conference in Japan to Make Bitcoin Cash the Best Coin,r/Bitcoincash,1278833,https://cryptopanic.com/news/1278833/Satoshis-Vision-Conference-in-Japan-to-Make-Bitcoin-Cash-the-Best-Coin
2018-03-04 17:15:17,8,7,13,1,0,0,0,0,0,0,0,0,0,0,0,Live Bitcoin News,Two Popular Cryptocurrency Exchanges in India to Suspend all Trading,livebitcoinnews.com,1277269,https://cryptopanic.com/news/1277269/Two-Popular-Cryptocurrency-Exchanges-in-India-to-Suspend-all-Trading
2018-03-04 14:57:03,3,8,0,1,0,0,0,0,0,0,0,0,0,0,0,ZyCrypto,Trump’s Trade War may make Bitcoin a Safe Hedge for Investors,zycrypto.com,1276076,https://cryptopanic.com/news/1276076/Trumps-Trade-War-may-make-Bitcoin-a-Safe-Hedge-for-Investors
2018-03-04 13:55:14,4,7,0,1,0,0,0,0,0,0,0,0,0,0,0,Bitcoin.com,Interest in Cryptocurrency Jumped 15-Fold in Kazakhstan,bitcoin.com,1275554,https://cryptopanic.com/news/1275554/Interest-in-Cryptocurrency-Jumped-15-Fold-in-Kazakhstan
2018-03-04 13:07:50,3,4,1,1,0,0,0,0,0,0,0,0,0,0,0,CoinTelegraph,"Bitcoin Comes Down From $11,500 Highs To Challenge $11k Support",cointelegraph.com,1275200,https://cryptopanic.com/news/1275200/Bitcoin-Comes-Down-From-11500-Highs-To-Challenge-11k-Support
2018-03-03 23:00:30,3,14,0,1,0,0,0,0,0,0,0,0,0,0,0,NewsBTC,Bitcoin Enters Bull Market as Dominance Index Surges Above 40%,newsbtc.com,1269811,https://cryptopanic.com/news/1269811/Bitcoin-Enters-Bull-Market-as-Dominance-Index-Surges-Above-40
2018-03-03 22:50:16.924386,10,17,0,1,0,0,1,0,0,0,0,0,0,0,0,r/btc Reddit,"I just spotted a Bitcoin Cash ATM in Ho Chi Minh City, VIETNAM! OMG!",r/btc,1269619,https://cryptopanic.com/news/1269619/I-just-spotted-a-Bitcoin-Cash-ATM-in-Ho-Chi-Minh-City-VIETNAM-OMG
2018-03-03 22:18:00,6,5,0,1,0,0,1,0,0,0,0,0,0,0,0,Bitcoin Twitter,2.0 Bar becomes the first bar in Paris to accept Bitcoin Cash!,@Bitcoin,1269427,https://cryptopanic.com/news/1269427/20-Bar-becomes-the-first-bar-in-Paris-to-accept-Bitcoin-Cash
2018-03-03 19:33:04,3,8,8,1,0,0,1,0,0,0,0,0,0,0,0,Bitcoin.com,Quarter Million Dollars Already Raised in Bitcoin Cash 48 Hour Challenge,bitcoin.com,1269020,https://cryptopanic.com/news/1269020/Quarter-Million-Dollars-Already-Raised-in-Bitcoin-Cash-48-Hour-Challenge
2018-03-03 18:24:36.404226,3,2,7,1,0,0,1,0,0,0,0,0,0,0,0,r/btc Reddit,"Paid a beer using Bitcoin Cash in Paris, adoption is real!",r/btc,1268002,https://cryptopanic.com/news/1268002/Paid-a-beer-using-Bitcoin-Cash-in-Paris-adoption-is-real
2018-03-03 14:29:05,5,6,0,1,0,0,0,0,0,0,0,0,0,0,0,ZyCrypto,Bitcoin Millionaire Investor Bill Miller Optimistic the Crypto Market Will Rise Again,zycrypto.com,1267093,https://cryptopanic.com/news/1267093/Bitcoin-Millionaire-Investor-Bill-Miller-Optimistic-the-Crypto-Market-Will-Rise-Again
2018-03-03 12:24:42,14,0,0,1,0,0,0,0,0,0,0,0,0,1,0,AMBCrypto,Fake Poloniex Exchange apps circulating the Play Store,ambcrypto.com,1266219,https://cryptopanic.com/news/1266219/Fake-Poloniex-Exchange-apps-circulating-the-Play-Store
2018-03-03 09:42:00,4,7,0,1,0,0,0,0,0,0,0,0,0,0,0,Use The Bitcoin,Dubai Promotes Blockchain Technology by Creating a Marketplace for Tourists,usethebitcoin.com,1264898,https://cryptopanic.com/news/1264898/Dubai-Promotes-Blockchain-Technology-by-Creating-a-Marketplace-for-Tourists
2018-03-03 03:20:11.876963,4,2,0,1,0,0,0,0,0,0,0,0,0,0,0,r/Bitcoin Reddit,Coinbase Hit With Class Action Claiming Insiders Benefited From 'Bitcoin Cash' Launch,r/Bitcoin,1262446,https://cryptopanic.com/news/1262446/Coinbase-Hit-With-Class-Action-Claiming-Insiders-Benefited-From-Bitcoin-Cash-Launch
2018-03-03 01:00:14,2,5,0,1,0,0,0,0,0,0,0,0,0,0,0,Bitcoinist,Will Cryptocurrency Replace National Currencies By 2030?,bitcoinist.com,1261630,https://cryptopanic.com/news/1261630/Will-Cryptocurrency-Replace-National-Currencies-By-2030
2018-03-02 20:30:02,0,4,3,1,0,0,1,0,0,0,0,0,0,0,0,Bitcoin.com,Bitpay Launches Bitcoin Cash Debit Card Top Ups,bitcoin.com,1258648,https://cryptopanic.com/news/1258648/Bitpay-Launches-Bitcoin-Cash-Debit-Card-Top-Ups
2018-03-02 20:00:41,4,8,2,1,0,0,1,0,0,0,0,0,0,0,0,Live Bitcoin News,Craig Wright Claims Bitcoin Cash Will get Privacy Features in May 2018,livebitcoinnews.com,1258349,https://cryptopanic.com/news/1258349/Craig-Wright-Claims-Bitcoin-Cash-Will-get-Privacy-Features-in-May-2018
2018-03-02 18:55:52,8,12,0,1,0,0,0,0,0,0,0,0,0,0,0,ZyCrypto,Germany Qualifies Bitcoin-Related Operations as Non-Taxable,zycrypto.com,1257525,https://cryptopanic.com/news/1257525/Germany-Qualifies-Bitcoin-Related-Operations-as-Non-Taxable
2018-03-02 18:10:05,22,35,0,1,0,0,0,0,0,0,0,0,0,0,0,AMBCrypto,"Post Binance and Kraken, Bitfinex now announces a 33% decrease in BTC withdrawal fees",ambcrypto.com,1257118,https://cryptopanic.com/news/1257118/Post-Binance-and-Kraken-Bitfinex-now-announces-a-33-decrease-in-BTC-withdrawal-fees
2018-03-02 17:20:59,6,2,2,1,0,0,0,0,0,0,0,0,0,0,0,AMBCrypto,U.K Central Bank wants to regulate the use of Bitcoins or crypto in fraudulent activities,ambcrypto.com,1256557,https://cryptopanic.com/news/1256557/UK-Central-Bank-wants-to-regulate-the-use-of-Bitcoins-or-crypto-in-fraudulent-activities
2018-03-02 17:07:31,12,19,0,1,0,0,0,0,0,0,0,0,0,0,0,AMBCrypto,40 Bitcoin sites’ ban order lifted in Russia after court order,ambcrypto.com,1256368,https://cryptopanic.com/news/1256368/40-Bitcoin-sites-ban-order-lifted-in-Russia-after-court-order
2018-03-02 16:45:36,1,8,2,1,0,0,1,0,0,0,0,0,0,0,0,Trustnodes,Bitcoin Cash Added to BitPay Visa Debit Card,trustnodes.com,1256144,https://cryptopanic.com/news/1256144/Bitcoin-Cash-Added-to-BitPay-Visa-Debit-Card
