published_at,important,positive,negative,BTC,ETH,XRP,BCH,LTC,XLM,EOS,NEO,MIOTA,DASH,XMR,VEN,source,title,domain,id,url
2018-02-12 11:31:41,6,10,0,1,0,0,0,0,0,0,0,0,0,0,0,AMBCrypto,ICO regulations going to be nationalized in Gibraltar and will be the first country to do so,ambcrypto.com,1056654,https://cryptopanic.com/news/1056654/ICO-regulations-going-to-be-nationalized-in-Gibraltar-and-will-be-the-first-country-to-do-so
2018-02-12 10:31:17,7,22,0,1,1,1,0,0,0,0,0,0,0,0,0,Coinspeaker,"Will Bitcoin and Ethereum Cross the $10,000 and $1,000 Marks This Week?",coinspeaker.com,1056340,https://cryptopanic.com/news/1056340/Will-Bitcoin-and-Ethereum-Cross-the-10000-and-1000-Marks-This-Week
2018-02-12 10:27:54,5,7,0,1,0,0,0,0,0,0,0,0,0,0,0,CoinJournal,Academia Responds to Surging Interest in Digital Assets by Offering Crypto/Blockchain Courses,coinjournal.net,1056171,https://cryptopanic.com/news/1056171/Academia-Responds-to-Surging-Interest-in-Digital-Assets-by-Offering-CryptoBlockchain-Courses
2018-02-12 09:50:23,9,22,6,1,0,0,0,0,0,0,0,0,0,0,0,CoinDesk,Bullish Signs Above $8K: Has Bitcoin Turned the Corner?,coindesk.com,1056046,https://cryptopanic.com/news/1056046/Bullish-Signs-Above-8K-Has-Bitcoin-Turned-the-Corner
2018-02-12 09:30:47,12,18,0,1,0,0,0,0,0,0,0,0,0,0,0,NewsBTC,Cryptocurrency Thrives in Europe With Small Banks Support,newsbtc.com,1055837,https://cryptopanic.com/news/1055837/Cryptocurrency-Thrives-in-Europe-With-Small-Banks-Support
2018-02-12 07:07:03,7,5,0,1,0,0,0,0,0,0,0,0,0,1,0,AMBCrypto,"Australian government systems hacked for Monero, Bitcoin and cryptocurrency mining",ambcrypto.com,1054967,https://cryptopanic.com/news/1054967/Australian-government-systems-hacked-for-Monero-Bitcoin-and-cryptocurrency-mining
2018-02-12 03:01:32,2,5,1,1,0,0,0,0,0,0,0,0,0,0,0,NewsBTC,Bitcoin Price Technical Analysis for 02/12/2018 – Make or Break Level,newsbtc.com,1053774,https://cryptopanic.com/news/1053774/Bitcoin-Price-Technical-Analysis-for-02122018-Make-or-Break-Level
2018-02-12 02:30:23,7,9,0,1,0,0,0,0,0,0,0,0,0,0,0,NewsBTC,Japan Remains Optimistic About Cryptocurrencies Despite Coincheck Heist and Recent Price Woes,newsbtc.com,1053591,https://cryptopanic.com/news/1053591/Japan-Remains-Optimistic-About-Cryptocurrencies-Despite-Coincheck-Heist-and-Recent-Price-Woes
2018-02-12 01:30:15,2,1,4,1,0,0,0,0,0,0,0,0,0,0,0,NewsBTC,Iceland May Implement Bitcoin Mining Tax Due to Energy Consumption,newsbtc.com,1053255,https://cryptopanic.com/news/1053255/Iceland-May-Implement-Bitcoin-Mining-Tax-Due-to-Energy-Consumption
2018-02-12 00:00:41,2,6,0,1,0,0,0,1,0,0,0,0,0,0,0,Bitcoin.com,Japan’s DMM Launches Large-Scale Cryptocurrency Mining Farm and Showroom,bitcoin.com,1052761,https://cryptopanic.com/news/1052761/Japans-DMM-Launches-Large-Scale-Cryptocurrency-Mining-Farm-and-Showroom
2018-02-11 23:00:35.855635,1,7,31,1,0,0,0,0,0,0,0,1,0,0,0,IOTAmarkets Reddit,I'm all in. Just converted the rest of my BTC to IOTA. Time to clench my asshole and HODL!,r/IOTAmarkets,1052346,https://cryptopanic.com/news/1052346/Im-all-in-Just-converted-the-rest-of-my-BTC-to-IOTA-Time-to-clench-my-asshole-and-HODL
2018-02-11 22:05:03,15,32,0,1,0,0,0,0,0,0,0,0,0,0,0,Bitcoin.com,Senate Candidate Accepts Largest Contribution in BTC,bitcoin.com,1052045,https://cryptopanic.com/news/1052045/Senate-Candidate-Accepts-Largest-Contribution-in-BTC
2018-02-11 21:55:02,12,17,0,1,0,0,0,0,0,0,0,0,0,0,0,NewsBTC,CFTC Commissioner: Crypto Industry Should Regulate Itself,newsbtc.com,1051927,https://cryptopanic.com/news/1051927/CFTC-Commissioner-Crypto-Industry-Should-Regulate-Itself
2018-02-11 21:30:57,7,8,0,1,0,0,0,0,0,0,0,0,0,0,0,Bitcoinist,University Students Rush to Take Cryptocurrency and Blockchain Courses,bitcoinist.com,1051948,https://cryptopanic.com/news/1051948/University-Students-Rush-to-Take-Cryptocurrency-and-Blockchain-Courses
2018-02-11 20:28:23,9,21,1,1,1,1,0,1,0,1,0,0,0,0,0,Bitcoin.com,New Crypto Exchanges Launch in South Korea Despite Lack of Fiat Deposits,bitcoin.com,1051425,https://cryptopanic.com/news/1051425/New-Crypto-Exchanges-Launch-in-South-Korea-Despite-Lack-of-Fiat-Deposits
2018-02-11 19:00:05,6,9,1,1,0,0,0,0,0,0,0,0,0,0,0,Bitcoin.com,"Roles of Regulators Decided in India, Rules on Bitcoin Coming Soon",bitcoin.com,1050995,https://cryptopanic.com/news/1050995/Roles-of-Regulators-Decided-in-India-Rules-on-Bitcoin-Coming-Soon
2018-02-11 18:37:35,5,10,1,1,0,1,0,0,0,0,0,0,0,0,0,CoinTelegraph,Bitcoin Price Makes Little Progress This Week As Analysts Spy $10k Resistance,cointelegraph.com,1050844,https://cryptopanic.com/news/1050844/Bitcoin-Price-Makes-Little-Progress-This-Week-As-Analysts-Spy-10k-Resistance
2018-02-11 18:30:38.357313,4,11,1,1,0,0,0,0,0,0,0,0,0,0,0,r/Bitcoin Reddit,Winklevoss Twins: 2018 Looks To Be Another Year Of Bitcoin,r/Bitcoin,1050703,https://cryptopanic.com/news/1050703/Winklevoss-Twins-2018-Looks-To-Be-Another-Year-Of-Bitcoin
2018-02-11 17:53:44,4,2,32,1,0,0,0,0,0,0,0,0,0,0,0,Use The Bitcoin,Cryptocurrency Investors in Japan to Pay Between 15 and 55 Percent on Profits,usethebitcoin.com,1050457,https://cryptopanic.com/news/1050457/Cryptocurrency-Investors-in-Japan-to-Pay-Between-15-and-55-Percent-on-Profits
2018-02-11 17:30:34,3,8,0,1,0,0,0,0,0,0,0,0,0,0,0,Bitcoin.com,Bitcoin Private Fork Aiming to Make Bitcoin Anonymous,bitcoin.com,1050365,https://cryptopanic.com/news/1050365/Bitcoin-Private-Fork-Aiming-to-Make-Bitcoin-Anonymous
2018-02-11 16:16:04,4,6,1,1,0,0,0,0,0,0,0,0,0,0,0,Cryptovest,Bitcoin Sets Out to Breach Congress Defenses; Crypto Big Names Back Brian Forde for Congress,cryptovest.com,1049874,https://cryptopanic.com/news/1049874/Bitcoin-Sets-Out-to-Breach-Congress-Defenses-Crypto-Big-Names-Back-Brian-Forde-for-Congress
2018-02-11 14:59:14,3,5,0,1,0,0,0,0,0,0,0,0,0,0,0,CoinTelegraph,Binance Vs. McAfee: Hack Rumors Controversy,cointelegraph.com,1049434,https://cryptopanic.com/news/1049434/Binance-Vs-McAfee-Hack-Rumors-Controversy
2018-02-11 13:40:22.589722,18,36,1,1,0,0,0,0,0,0,0,0,0,0,0,r/Bitcoin Reddit,I officially witnessed the future today. I just made my first real purchase over lightning on Bitcoin mainnet. ,r/Bitcoin,1048898,https://cryptopanic.com/news/1048898/I-officially-witnessed-the-future-today-I-just-made-my-first-real-purchase-over-lightning-on-Bitcoin-mainnet
2018-02-11 13:20:40.552673,23,28,14,1,0,0,0,0,0,0,0,0,0,0,0,r/BitcoinMarkets Reddit,France and Germany’s finance ministers and top central bankers issued a joint statement on the G20 to discuss cryptoassets at its next summit in Buenos Aires from 19 March 2018 to 20 March 2018.,r/BitcoinMarkets,1048794,https://cryptopanic.com/news/1048794/France-and-Germanys-finance-ministers-and-top-central-bankers-issued-a-joint-statement-on-the-G20-to-discuss-cryptoassets-at-its-next-summit-in-Buenos-Aires-from-19-March-2018-to-20-March-2018
2018-02-11 13:12:20,11,21,0,1,0,0,0,0,0,0,0,0,0,0,0,Use The Bitcoin,CEO of Pantera Capital Believes Bitcoin is ‘Under-Owned’ Among Institutional Investors,usethebitcoin.com,1048771,https://cryptopanic.com/news/1048771/CEO-of-Pantera-Capital-Believes-Bitcoin-is-Under-Owned-Among-Institutional-Investors
2018-02-11 09:00:38,6,12,0,1,0,0,0,0,0,0,0,0,0,0,0,Bitcoinist,Lingerie Tycoon Sells 50 Dubai Apartments for Bitcoin,bitcoinist.com,1047958,https://cryptopanic.com/news/1047958/Lingerie-Tycoon-Sells-50-Dubai-Apartments-for-Bitcoin
2018-02-11 07:30:24,2,1,4,1,0,0,0,0,0,0,0,0,0,0,0,NewsBTC,Bitcoin Price Weekly Analysis – Can BTC/USD Break This?,newsbtc.com,1047352,https://cryptopanic.com/news/1047352/Bitcoin-Price-Weekly-Analysis-Can-BTCUSD-Break-This
2018-02-11 03:31:02,4,6,1,1,0,0,1,0,0,0,0,0,0,0,0,Bitcoin.com,BCH Wallet ‘Handcash’ Enables Bitcoin Cash NFC Transactions,bitcoin.com,1046455,https://cryptopanic.com/news/1046455/BCH-Wallet-Handcash-Enables-Bitcoin-Cash-NFC-Transactions
2018-02-11 03:00:02,8,17,0,1,0,0,0,0,0,0,0,0,0,0,0,Bitcoinist,Pantera Capital CEO: Bitcoin Bear Market About to Turn Bullish,bitcoinist.com,1046533,https://cryptopanic.com/news/1046533/Pantera-Capital-CEO-Bitcoin-Bear-Market-About-to-Turn-Bullish
2018-02-11 01:11:02,8,22,1,1,0,0,0,0,0,0,0,0,0,0,0,Bitcoin.com,Bitcoin is “Under-Owned” Among Institutional Investors says Dan Morehead,bitcoin.com,1045861,https://cryptopanic.com/news/1045861/Bitcoin-is-Under-Owned-Among-Institutional-Investors-says-Dan-Morehead
2018-02-11 00:30:07,3,8,0,1,0,0,0,0,0,0,0,0,0,0,0,BTC Manager,Bitcoin Donations Fueling Election Campaigns to Victory,btcmanager.com,1045782,https://cryptopanic.com/news/1045782/Bitcoin-Donations-Fueling-Election-Campaigns-to-Victory
2018-02-10 23:30:47,5,2,10,1,0,0,0,0,0,0,0,0,0,0,0,NewsBTC,"Caught Infraud: Thailand Police Seize 100,000 Bitcoins From Darknet Marketplace",newsbtc.com,1045326,https://cryptopanic.com/news/1045326/Caught-Infraud-Thailand-Police-Seize-100000-Bitcoins-From-Darknet-Marketplace
2018-02-10 20:00:44.176257,5,11,0,1,0,0,0,0,0,0,0,0,0,0,0,r/Bitcoin Reddit,"Arizona Passes Bill to Let Residents Pay Taxes in Bitcoin and Other Crypto. This is like Weed legalization... it starts with one state, then acceptance spreads!",r/Bitcoin,1044112,https://cryptopanic.com/news/1044112/Arizona-Passes-Bill-to-Let-Residents-Pay-Taxes-in-Bitcoin-and-Other-Crypto-This-is-like-Weed-legalization-it-starts-with-one-state-then-acceptance-spreads
2018-02-10 19:38:48,13,26,0,1,0,0,0,0,0,0,0,0,0,0,0,Use The Bitcoin,Arizona Proposed Two Bills To Allow People Pay Taxes With Cryptocurrency,usethebitcoin.com,1044015,https://cryptopanic.com/news/1044015/Arizona-Proposed-Two-Bills-To-Allow-People-Pay-Taxes-With-Cryptocurrency
2018-02-10 19:30:16,1,7,0,1,0,0,0,0,0,0,0,0,0,0,0,Live Bitcoin News,Zap Beta Wallet for Bitcoin’s Lightning Network Enters the Testing Phase,livebitcoinnews.com,1043961,https://cryptopanic.com/news/1043961/Zap-Beta-Wallet-for-Bitcoins-Lightning-Network-Enters-the-Testing-Phase
2018-02-10 19:20:04.408030,4,9,1,1,0,0,1,1,0,0,0,0,0,0,0,Bitcoin Cash Reddit,"Coinbase Launches PayPal-Like Service for Paying Merchants with BCH, ETH, LTC & BTC",r/Bitcoincash,1043862,https://cryptopanic.com/news/1043862/Coinbase-Launches-PayPal-Like-Service-for-Paying-Merchants-with-BCH-ETH-LTC-BTC
2018-02-10 19:00:54.186610,0,4,3,1,0,0,1,0,0,0,0,0,0,0,0,r/btc Reddit,Since I started using yours.org my usage of the Bitcoin Cash blockchain has increased by over 1000%,r/btc,1043738,https://cryptopanic.com/news/1043738/Since-I-started-using-yoursorg-my-usage-of-the-Bitcoin-Cash-blockchain-has-increased-by-over-1000
2018-02-10 18:04:55,3,5,0,1,0,0,0,0,0,0,0,0,0,0,0,ZyCrypto,Anarchist hacker thinks Bitcoin has lost its original philosophy,zycrypto.com,1043419,https://cryptopanic.com/news/1043419/Anarchist-hacker-thinks-Bitcoin-has-lost-its-original-philosophy
2018-02-10 17:19:35,34,55,0,1,0,0,0,0,0,0,0,0,0,0,0,Live Bitcoin News,Mario Draghi Claims European Banks Will Show a Positive Interest in Bitcoin Soon,livebitcoinnews.com,1043120,https://cryptopanic.com/news/1043120/Mario-Draghi-Claims-European-Banks-Will-Show-a-Positive-Interest-in-Bitcoin-Soon
2018-02-15 06:44:24,17,28,0,1,0,0,0,1,0,0,0,0,0,0,0,Cointia,Coinbase Now Allows Ecommerce Shops to Accept Cryptocurrencies Payments,cointia.com,1088802,https://cryptopanic.com/news/1088802/Coinbase-Now-Allows-Ecommerce-Shops-to-Accept-Cryptocurrencies-Payments
2018-02-15 04:30:25,16,22,1,1,0,1,0,0,0,0,0,0,0,0,0,Bitcoinist,It’s High Time Financial Institutions Consider Crypto as a Tool for Efficient Money Transfers,bitcoinist.com,1088206,https://cryptopanic.com/news/1088206/Its-High-Time-Financial-Institutions-Consider-Crypto-as-a-Tool-for-Efficient-Money-Transfers
2018-02-10 17:14:58,42,67,1,1,1,0,1,1,0,0,0,0,0,0,0,Trustnodes,"Coinbase Launches a PayPal Like Plugin For Ethereum, Bitcoin, Bitcoin Cash and Litecoin",trustnodes.com,1043047,https://cryptopanic.com/news/1043047/Coinbase-Launches-a-PayPal-Like-Plugin-For-Ethereum-Bitcoin-Bitcoin-Cash-and-Litecoin
2018-02-10 15:50:41,14,20,0,1,0,0,0,0,0,0,0,0,0,0,0,BTC Manager,eBay Signs Accord with Adyen and Cryptocurrency Payment Platform BitPay,btcmanager.com,1042514,https://cryptopanic.com/news/1042514/eBay-Signs-Accord-with-Adyen-and-Cryptocurrency-Payment-Platform-BitPay
2018-02-10 15:22:59,4,12,0,1,1,0,0,0,0,0,0,0,0,0,0,Ethereum World News,Ethereum Outdoing Bitcoin When it Comes to Communities Support and Confidence,ethereumworldnews.com,1042260,https://cryptopanic.com/news/1042260/Ethereum-Outdoing-Bitcoin-When-it-Comes-to-Communities-Support-and-Confidence
2018-02-10 14:50:33,3,1,6,1,0,0,0,0,0,0,0,0,0,0,0,BTC Manager,Japan Announces Cryptocurrency tax at 15 to 55 Percent,btcmanager.com,1042515,https://cryptopanic.com/news/1042515/Japan-Announces-Cryptocurrency-tax-at-15-to-55-Percent
2018-02-10 14:45:05,14,5,31,1,0,0,0,0,0,0,0,0,0,0,0,Bitcoinist,"France & Germany ‘Threatened’ by Bitcoin, Want Global Crypto Crackdown",bitcoinist.com,1042035,https://cryptopanic.com/news/1042035/France-Germany-Threatened-by-Bitcoin-Want-Global-Crypto-Crackdown
2018-02-10 14:40:27,10,22,0,1,1,1,0,0,0,0,0,0,1,0,0,Feed - Hacked.Com,Crypto Update: Ripple Leads Weekend Rally despite Pull-Back,hacked.com,1041917,https://cryptopanic.com/news/1041917/Crypto-Update-Ripple-Leads-Weekend-Rally-despite-Pull-Back
2018-02-10 14:23:10,3,10,0,1,0,0,0,0,0,0,0,0,0,0,0,Bitcoin.com,Ledger X President: $50K Bitcoin Bet Saw a $1M Premium the Same Day,bitcoin.com,1041807,https://cryptopanic.com/news/1041807/Ledger-X-President-50K-Bitcoin-Bet-Saw-a-1M-Premium-the-Same-Day
2018-02-10 13:34:59,16,5,9,1,0,0,0,0,0,0,0,0,0,0,0,AMBCrypto,Italy’s cryptocurrency Bitgrail suspends operations,ambcrypto.com,1041549,https://cryptopanic.com/news/1041549/Italys-cryptocurrency-Bitgrail-suspends-operations
2018-02-10 13:34:53,4,9,0,1,0,0,0,0,0,0,0,0,0,0,0,Bitcoin.com,Law to Legalize Crypto Mining Introduced in Armenia,bitcoin.com,1041551,https://cryptopanic.com/news/1041551/Law-to-Legalize-Crypto-Mining-Introduced-in-Armenia
2018-02-10 12:59:43,16,29,1,1,1,0,0,0,0,0,0,0,0,0,0,ZyCrypto,Cryptocurrency enthusiasts think Ethereum is Greater than Bitcoin,zycrypto.com,1041365,https://cryptopanic.com/news/1041365/Cryptocurrency-enthusiasts-think-Ethereum-is-Greater-than-Bitcoin
2018-02-10 11:10:29,19,40,3,1,0,0,0,0,0,0,0,0,0,0,0,AMBCrypto,Bitcoin and other altcoins pick up speed again – Is this the end of a bearish market?,ambcrypto.com,1040828,https://cryptopanic.com/news/1040828/Bitcoin-and-other-altcoins-pick-up-speed-again-Is-this-the-end-of-a-bearish-market
2018-02-10 09:53:30,20,21,0,1,0,0,0,0,0,0,0,0,0,0,0,AMBCrypto,G20 summit to discuss about regulating Bitcoin and cryptocurrencies,ambcrypto.com,1040476,https://cryptopanic.com/news/1040476/G20-summit-to-discuss-about-regulating-Bitcoin-and-cryptocurrencies
2018-02-10 04:30:03,3,7,0,1,0,0,0,0,0,0,0,0,0,0,0,Bitcoinist,Bitcoin May Finally Have a Friend in Washington,bitcoinist.com,1039153,https://cryptopanic.com/news/1039153/Bitcoin-May-Finally-Have-a-Friend-in-Washington
2018-02-10 03:10:56.277639,29,1,4,1,0,0,0,0,0,0,0,0,0,0,0,r/BitcoinMarkets Reddit,I lost ~40k USD today. Reminder to keep coins off exchanges if you are not trading.,r/BitcoinMarkets,1038652,https://cryptopanic.com/news/1038652/I-lost-40k-USD-today-Reminder-to-keep-coins-off-exchanges-if-you-are-not-trading
2018-02-10 03:00:41,1,1,3,1,0,0,0,0,0,0,0,0,0,0,0,Bitcoin.com,"Bitcoin’s Volatility Is a Feature, Not a Bug",bitcoin.com,1038648,https://cryptopanic.com/news/1038648/Bitcoins-Volatility-Is-a-Feature-Not-a-Bug
2018-02-10 01:30:10.236348,2,3,13,1,0,0,1,0,0,0,0,0,0,0,0,Bitcoin Cash Reddit,"Over time, Bitcoin Cash (BCH) is gaining on Bitcoin (BTC).",r/Bitcoincash,1038143,https://cryptopanic.com/news/1038143/Over-time-Bitcoin-Cash-BCH-is-gaining-on-Bitcoin-BTC
2018-02-10 00:37:00,1,11,0,1,1,1,0,1,1,1,1,0,0,0,0,CoinTelegraph,"Bitcoin, Ethereum, Bitcoin Cash, Ripple, Stellar, Litecoin, Cardano, NEO, EOS: Price Analysis, Feb. 09",cointelegraph.com,1037964,https://cryptopanic.com/news/1037964/Bitcoin-Ethereum-Bitcoin-Cash-Ripple-Stellar-Litecoin-Cardano-NEO-EOS-Price-Analysis-Feb-09
2018-02-09 23:34:21,0,5,0,1,0,0,0,0,0,0,0,0,0,0,0,Bitcoin.com,Russia’s Largest Bank Caught Employees Mining For Crypto,bitcoin.com,1037340,https://cryptopanic.com/news/1037340/Russias-Largest-Bank-Caught-Employees-Mining-For-Crypto
2018-02-09 23:14:49,6,17,0,1,0,0,0,0,0,0,0,0,0,0,0,Ethereum World News,Bullish on the Bitcoin Price – The Winklevoss Brothers,ethereumworldnews.com,1037205,https://cryptopanic.com/news/1037205/Bullish-on-the-Bitcoin-Price-The-Winklevoss-Brothers
2018-02-09 23:12:55,10,2,18,1,0,0,0,0,0,0,0,0,0,0,0,CoinTelegraph,Japanese Crypto Investors To Pay Tax Of Up To 55 Percent On Profits,cointelegraph.com,1037268,https://cryptopanic.com/news/1037268/Japanese-Crypto-Investors-To-Pay-Tax-Of-Up-To-55-Percent-On-Profits
2018-02-09 21:30:57,5,11,0,1,1,0,0,0,0,0,0,0,0,0,0,BTC Manager,Winklevoss Brothers: Bitcoin will reach a Market Cap of $5 Trillion,btcmanager.com,1036690,https://cryptopanic.com/news/1036690/Winklevoss-Brothers-Bitcoin-will-reach-a-Market-Cap-of-5-Trillion
2018-02-09 21:00:23,1,3,26,1,1,0,1,0,0,0,0,0,0,0,0,Live Bitcoin News,Bitcoin Cash Price Surge Makes Competitors Look bad,livebitcoinnews.com,1036272,https://cryptopanic.com/news/1036272/Bitcoin-Cash-Price-Surge-Makes-Competitors-Look-bad
2018-02-09 20:00:52,5,3,5,1,0,0,0,1,0,0,0,0,0,0,0,Bitcoin.com,Hong Kong Cracks Down on Securities Tokens – 7 Crypto Exchanges Targeted,bitcoin.com,1035811,https://cryptopanic.com/news/1035811/Hong-Kong-Cracks-Down-on-Securities-Tokens-7-Crypto-Exchanges-Targeted
2018-02-09 19:49:09,4,5,0,1,0,0,0,0,0,0,0,0,0,0,0,Live Bitcoin News,Binance Returns to the Land of the Living After Extended Maintenance,livebitcoinnews.com,1035723,https://cryptopanic.com/news/1035723/Binance-Returns-to-the-Land-of-the-Living-After-Extended-Maintenance
2018-02-09 19:35:11,9,13,0,1,0,0,0,0,0,0,0,0,0,0,0,Bitcoin.com,Arizona Closer to Accepting Bitcoin and Regulating ICOs,bitcoin.com,1035651,https://cryptopanic.com/news/1035651/Arizona-Closer-to-Accepting-Bitcoin-and-Regulating-ICOs
2018-02-09 18:36:02,5,1,3,1,0,0,0,0,0,0,0,0,0,0,0,CoinTelegraph,IRS Forms New Team To Track Down Crypto Tax Evaders,cointelegraph.com,1035175,https://cryptopanic.com/news/1035175/IRS-Forms-New-Team-To-Track-Down-Crypto-Tax-Evaders
2018-02-09 18:34:00,18,33,1,1,0,0,0,0,0,0,0,0,0,0,0,Investopedia,"Bitcoin Will Hit $320,000: Winkelvoss Twins",investopedia.com,1035122,https://cryptopanic.com/news/1035122/Bitcoin-Will-Hit-320000-Winkelvoss-Twins
2018-02-09 18:30:32,4,6,0,1,0,0,0,0,0,0,0,0,0,0,0,Bitcoinist,Rabobank Fined $369M for Money Laundering After Calling Bitcoin ‘Risky’,bitcoinist.com,1035288,https://cryptopanic.com/news/1035288/Rabobank-Fined-369M-for-Money-Laundering-After-Calling-Bitcoin-Risky
2018-02-09 18:01:05.400154,1,7,8,1,0,0,0,0,0,0,0,0,0,0,0,r/BitcoinMarkets Reddit,Chart looking dangerous.,r/BitcoinMarkets,1034793,https://cryptopanic.com/news/1034793/Chart-looking-dangerous
2018-02-09 17:40:25.212231,4,7,1,1,0,1,0,0,0,0,0,0,0,0,0,Ripple Reddit,BTC / XRP pattern split; encouraging signs,r/Ripple,1034585,https://cryptopanic.com/news/1034585/BTC-XRP-pattern-split-encouraging-signs
2018-02-09 17:32:20,8,16,0,1,0,0,0,0,0,0,0,0,0,0,0,Trustnodes,Fed Economists: Cryptocurrencies “Provide a Store of Value” in a “Trustless Environment”,trustnodes.com,1034543,https://cryptopanic.com/news/1034543/Fed-Economists-Cryptocurrencies-Provide-a-Store-of-Value-in-a-Trustless-Environment
2018-02-09 17:30:27,2,5,1,1,1,1,0,0,0,0,0,0,0,0,0,Profit Confidential,Ripple Price Prediction 2018: Should You Invest Amid Bitcoin Volatility?,profitconfidential.com,1034544,https://cryptopanic.com/news/1034544/Ripple-Price-Prediction-2018-Should-You-Invest-Amid-Bitcoin-Volatility
2018-02-09 16:16:17,13,17,0,1,0,0,0,0,0,0,0,0,0,0,0,AMBCrypto,Mike Novogratz starts a cryptocurrency merchant bank,ambcrypto.com,1033846,https://cryptopanic.com/news/1033846/Mike-Novogratz-starts-a-cryptocurrency-merchant-bank
2018-02-09 15:31:03.281775,0,4,5,1,0,0,0,0,0,0,0,0,0,0,0,r/Bitcoin Reddit,Bitcoin Hodlers during the next bull run!,r/Bitcoin,1033405,https://cryptopanic.com/news/1033405/Bitcoin-Hodlers-during-the-next-bull-run
2018-02-09 15:11:18,11,30,1,1,0,0,0,0,0,0,0,0,0,0,0,CryptoPost,Bitcoin Final Step To Confirm The Uptrend,cryptopost.com,1033230,https://cryptopanic.com/news/1033230/Bitcoin-Final-Step-To-Confirm-The-Uptrend
2018-02-09 14:30:22,9,26,0,1,0,0,0,0,0,0,0,0,0,0,0,Bitcoinist,Shark Tank’s Robert Herjavec: ‘Cryptocurrency is the Future’,bitcoinist.com,1032927,https://cryptopanic.com/news/1032927/Shark-Tanks-Robert-Herjavec-Cryptocurrency-is-the-Future
2018-02-09 14:26:46,6,3,0,1,0,0,0,0,0,0,0,0,0,0,0,Coindoo,New Users Can Register On Bithumb Again,coindoo.com,1032897,https://cryptopanic.com/news/1032897/New-Users-Can-Register-On-Bithumb-Again
2018-02-09 13:48:00,1,1,17,1,0,0,0,0,0,0,0,0,0,0,0,Coin Idol,The Tax Authority of Lithuania Closes Bitcoin ATMs in Shopping Mall,coinidol.com,1032461,https://cryptopanic.com/news/1032461/The-Tax-Authority-of-Lithuania-Closes-Bitcoin-ATMs-in-Shopping-Mall
2018-02-09 13:28:16,3,16,0,1,0,0,0,1,0,0,0,0,0,0,0,Profit Confidential,Litecoin Price Forecast: LTC Overtakes Bitcoin in One Part of the Digital World,profitconfidential.com,1032344,https://cryptopanic.com/news/1032344/Litecoin-Price-Forecast-LTC-Overtakes-Bitcoin-in-One-Part-of-the-Digital-World
2018-02-09 12:42:26,20,40,1,1,0,0,0,0,0,0,0,0,0,0,0,AMBCrypto,Binance is back online with a 70% discount on trading fees,ambcrypto.com,1031966,https://cryptopanic.com/news/1031966/Binance-is-back-online-with-a-70-discount-on-trading-fees
2018-02-09 12:30:09,5,6,0,1,0,0,0,0,0,0,0,0,0,0,0,Bitcoinist,Google Trends Data Suggests Bitcoin Price May Have Bottomed Out,bitcoinist.com,1031965,https://cryptopanic.com/news/1031965/Google-Trends-Data-Suggests-Bitcoin-Price-May-Have-Bottomed-Out
2018-02-09 12:26:10,2,7,0,1,0,0,0,0,0,0,0,0,0,0,0,Coindoo,Russians Were Caught Using a Supercomputer to Mine Crypto,coindoo.com,1031818,https://cryptopanic.com/news/1031818/Russians-Were-Caught-Using-a-Supercomputer-to-Mine-Crypto
2018-02-09 11:56:56,14,19,0,1,0,0,0,0,0,0,0,0,0,0,0,CoinTelegraph,"Breaking: Crypto Exchange Binance Relaunches After Upgrade, Grants Users 70% Fee Discount",cointelegraph.com,1031719,https://cryptopanic.com/news/1031719/Breaking-Crypto-Exchange-Binance-Relaunches-After-Upgrade-Grants-Users-70-Fee-Discount
2018-02-09 10:30:05,14,25,2,1,0,0,0,0,0,0,0,0,0,0,0,Bitcoinist,Binance to John Mcafee: Blockchain Public Ledger Disproves Your FUD,bitcoinist.com,1031138,https://cryptopanic.com/news/1031138/Binance-to-John-Mcafee-Blockchain-Public-Ledger-Disproves-Your-FUD
2018-02-09 10:00:04,8,21,0,1,0,0,0,0,0,0,0,0,0,0,0,CoinDesk,Bitcoin Price Looks North as Stock Market Falls Again,coindesk.com,1030983,https://cryptopanic.com/news/1030983/Bitcoin-Price-Looks-North-as-Stock-Market-Falls-Again
2018-02-09 09:00:03,5,10,0,1,0,0,0,0,0,0,0,0,0,0,0,NewsBTC,$4 Billion Foxconn Chairman Invests in Cryptocurrency Merchant Bank,newsbtc.com,1030607,https://cryptopanic.com/news/1030607/4-Billion-Foxconn-Chairman-Invests-in-Cryptocurrency-Merchant-Bank
2018-02-09 08:29:12,18,18,0,1,0,0,0,0,0,0,0,0,0,0,0,Coindoo,"No Attack Has Occurred, replied the CEO of Binance",coindoo.com,1030428,https://cryptopanic.com/news/1030428/No-Attack-Has-Occurred-replied-the-CEO-of-Binance
2018-02-09 08:05:32,8,15,0,1,0,0,0,0,0,0,0,0,0,0,0,NewsBTC,Bitcoin Demand From Academia and College Students Rapidly Rises,newsbtc.com,1030306,https://cryptopanic.com/news/1030306/Bitcoin-Demand-From-Academia-and-College-Students-Rapidly-Rises
2018-02-09 06:56:57,22,46,0,1,0,1,1,1,0,0,0,0,0,0,0,AMBCrypto,Indian cryptocurrency exchange Zebpay adds XRP to their portal,ambcrypto.com,1029874,https://cryptopanic.com/news/1029874/Indian-cryptocurrency-exchange-Zebpay-adds-XRP-to-their-portal
2018-02-09 06:03:39,12,25,0,1,0,0,0,0,0,0,0,0,0,0,0,NewsBTC,"Hedge Fund Investor: Bitcoin Already Hit Bottom, Ready to Surge",newsbtc.com,1029588,https://cryptopanic.com/news/1029588/Hedge-Fund-Investor-Bitcoin-Already-Hit-Bottom-Ready-to-Surge
2018-02-09 04:08:32,3,5,0,1,0,0,1,0,0,0,0,0,0,0,0,NewsBTC,Bitcoin Cash Price Technical Analysis – BCH/USD Rallies Past Key Resistance,newsbtc.com,1029029,https://cryptopanic.com/news/1029029/Bitcoin-Cash-Price-Technical-Analysis-BCHUSD-Rallies-Past-Key-Resistance
2018-02-09 01:00:38,13,23,0,1,0,0,0,0,0,0,0,0,0,0,0,NewsBTC,"Shark Tank Investor, Robert Herjavec, Bullish on Cryptocurrency and Blockchain",newsbtc.com,1027972,https://cryptopanic.com/news/1027972/Shark-Tank-Investor-Robert-Herjavec-Bullish-on-Cryptocurrency-and-Blockchain
2018-02-09 00:48:37,4,23,0,1,0,0,0,0,0,0,1,0,0,0,0,Ethereum World News,Neo Value Could be 1/3 of a Bitcoin,ethereumworldnews.com,1027883,https://cryptopanic.com/news/1027883/Neo-Value-Could-be-13-of-a-Bitcoin
2018-02-09 00:28:26,9,8,0,1,0,1,0,0,0,0,0,0,0,0,0,CoinTelegraph,"Dow Jones Drops Another 1000 Points In A Week, Crypto Markets Don’t Quite Follow",cointelegraph.com,1027801,https://cryptopanic.com/news/1027801/Dow-Jones-Drops-Another-1000-Points-In-A-Week-Crypto-Markets-Dont-Quite-Follow
2018-02-08 22:31:03.825104,4,16,0,1,0,0,0,0,0,0,0,0,0,0,0,r/Bitcoin Reddit,"Goldman Sachs Claims Cryptocurrency Will Collapse, While Privately Building Billion Dollar Trading Desk",r/Bitcoin,1026830,https://cryptopanic.com/news/1026830/Goldman-Sachs-Claims-Cryptocurrency-Will-Collapse-While-Privately-Building-Billion-Dollar-Trading-Desk
2018-02-08 21:50:20.862833,2,4,21,1,0,0,1,0,0,0,0,0,0,0,0,r/BitcoinMarkets Reddit,Why is BCH pumping today?,r/BitcoinMarkets,1026514,https://cryptopanic.com/news/1026514/Why-is-BCH-pumping-today
2018-02-08 21:00:57,4,7,0,1,0,0,0,1,0,0,0,0,1,1,0,NewsBTC,Litecoin And Dash Are Taking Over The Dark Web,newsbtc.com,1026124,https://cryptopanic.com/news/1026124/Litecoin-And-Dash-Are-Taking-Over-The-Dark-Web
